"URL","NOMBRE","DESCRIPCION"
"https://www.computrabajo.com.co/ofertas-de-trabajo/oferta-de-trabajo-de-bi-analyst-senior-en-bogota-dc-B0B54C81FB15606861373E686DCF3405","BI  Analyst Senior","Se requiere profesional en Economía, Ingeniería Industrial, Mercadeo y publicidad, Ingeniería de Sistemas, Administración de Empresas, Negocios Internacionales, experiencia  mínimo de dos años en  análisis comercial, inteligencia comercial o inteligencia de negocios, Análisis Trade Marketing con uso de herramientas de BI.Requisitos: -Indispensable nivel avanzado de Excel-Dominio de Google DataStudio, Power BI.,-Dominio de manejadores de datos SQL, MySql, Power Query, Power Pivot. -Capacidad argumentativa alta.-Capacidad de storytelling alto.-Inglés avanzado"
"https://www.computrabajo.com.co/ofertas-de-trabajo/oferta-de-trabajo-de-asesor-marketing-digital-en-medellin-321E3FEBF5778D2B61373E686DCF3405","Asesor Marketing Digital","Importante empresa del sector tecnológico, se encuentra en búsqueda de ASESOR MARKETING DIGITAL, quien se encargará de realizar ventas por medio de redes sociales y páginas web. Debe contar con mínimo 2 años de experiencia en la labor y amplia experiencia en manejo de redes sociales y páginas web para ventas. Salario: $1.000.000 más prestaciones de ley y comisiones (hasta $1.000.000)"
"https://www.computrabajo.com.co/ofertas-de-trabajo/oferta-de-trabajo-de-jefe-trade-marketing-vinos-o-licores-en-bogota-dc-87C6EF16F25612B961373E686DCF3405","Jefe Trade Marketing - Vinos o Licores","Buscamos profesional en Administración de Empresas, Mercadeo y Publicidad, o Ingeniería apasionado por la imagen de marcas y ventas con experiencia en consumo masivo, ideal en licores o vinos. Misión del cargo: Impulsar el consumo y acelerar las ventas mediante la planificación y coordinación de tácticas en los canales, mejorar la rotación del producto en el punto de venta, desarrollar el merchandising. Objetivo del cargo: Ejecutar los lineamientos estratégicos de las marcas durante el año según los planes definidos para las mismas, teniendo en cuenta la optimización y ejecución al 100% del presupuesto, herramientas y estrategias asignadas. Funciones del cargo:- Seguimiento de ventas diario, analizando oportunidades por canales y vendedores.- Análisis de comportamientos de consumidor y cifras de mercado.- Revisión, análisis y ejecución de alianzas que permitan fortalecer las marcas en los canales.- Garantizar el cumplimiento de objetivos mediante la planificación, ejecución y evaluación de planes para los canales.- Control del presupuesto.- Gestionar compras, parametrizaciones y todos los procesos necesarios para que se ejecuten las herramientas definidas.- Supervisar y trabajo de campo constante que garanticen el cumplimiento de la cuota de ventas.- Coordinar las capacitaciones necesarias para el personal de la compañía.- Dar input a compras para la consecución de material novedoso (Merchandising, visibilidad, etc.)"
"https://www.computrabajo.com.co/ofertas-de-trabajo/oferta-de-trabajo-de-profesional-marketing-digital-en-bucaramanga-FCBC8B545EA090D361373E686DCF3405","Profesional marketing digital","Reconocida empresa importadora del sector, requiere profesional en marketing digital, debe tener titulo profesional en areas relacionadas y experiencia mínima de 3 anos en gestión de marketing. Salario entre 2.000.000 a 2.500.000 dependiendo del ajuste al perfil."
"https://www.computrabajo.com.co/ofertas-de-trabajo/oferta-de-trabajo-de-asistente-de-marketing-medio-tiempo-y-en-casa-en-cali-D4C93E7575A056D361373E686DCF3405","Asistente de marketing - Medio tiempo y en casa.","Empresa de Estados Unidos, busca para su equipo, una asistente de marketing que se encargara de :  - Soporte en instagram (organizar fotos), engagement.  - Newsletter (mailchimp)  - Subir contenido y actualizar pagina web  - Realizar piezas promocionales para IG y FB  - Encargada de eventos (pieza promocional, crearlos en la Página web, FB, promocion, etc)  - Editar videos con iMovie (super plus)  - Enviar emails  - Asistir administrativa y personalmente a su jefe directo - Otras actividades por asignar por el jefe"
"https://www.computrabajo.com.co/ofertas-de-trabajo/oferta-de-trabajo-de-asistente-comercial-y-servicio-al-cliente-marketing-digital-2-anos-experiencia-en-medellin-519D8604AF65031661373E686DCF3405","Asistente comercial y Servicio al cliente Marketing Digital - +2 años experiencia","Buscamos asistente comercial y de servicio al cliente con experiencia +2 años en la comercialización de soluciones informáticas en la nube. Profesional (o estudiante) en Marketing o carreras afines Conocimientos en marketing digital, CRM, ejecución de campañas, Conocimiento en aplicaciones y soluciones en informática. Nivel de ingles intermedio"
"https://www.computrabajo.com.co/ofertas-de-trabajo/oferta-de-trabajo-de-lider-dpto-marketing-home-office-pereira-en-pereira-0C27711F64DC5E0161373E686DCF3405","Lider Dpto Marketing - Home Office/ Pereira","Importante Holding Empresarial con presencia en 9 países a nivel Latinoamérica, abre convocatoria para jóvenes profesionales con el fin de vincularlos a nuestro proyecto empresarial Los seleccionados harán parte del departamento de marketing estratégico y dentro de sus principales funciones tendrá:- El manejo de las relaciones públicas de la compañía- Participación en eventos empresariales- Creación de estrategias de posicionamiento de marcas - Evaluación de perfiles empresariales - Gestión de alianzas estrategias y convenios empresariales.- Desarrollo administrativo y organizacionalPERFIL DEL CARGO- Buen manejo de relaciones interpersonales- Facilidad para trabajar con gente - Autonomía y liderazgo- Que tenga dentro de su visión profesional a mediano plazo ocupar cargos gerenciales y directivos REQUISITOS PARA TRABAJO -Excelente equipo de cómputo.-Internet potente.- Plan de datos y llamadas ilimitadas- Excelente expresión verbal.- Presentación personal impecable - Determinado a ser medido por resultados y metas alcanzadas.BENEFICIOS DE LA PROPUESTA- Capacitación constante y permanente para el cargo- Formación Integral para llegar a la gerencia del departamento de mercadeo- Ingresos promedio de $2.000.000  -Vinculación inicial por prestación de servicios, posibilidad de contrato a término indefinido, plan de carrera y ascensos con vinculación laboral definitiva.- Entrenamiento en mentalidad empresarial."
"https://www.computrabajo.com.co/ofertas-de-trabajo/oferta-de-trabajo-de-ejecutivo-de-marketing-home-office-bogota-en-bogota-dc-A0EAAEE0A32425FF61373E686DCF3405","Ejecutivo de Marketing - Home Office/ Bogota","Importante Holding Empresarial con presencia en 9 países a nivel Latinoamérica, abre convocatoria para jóvenes profesionales con el fin de vincularlos a nuestro proyecto empresarial Los seleccionados harán parte del departamento de marketing estratégico y dentro de sus principales funciones tendrá:- El manejo de las relaciones públicas de la compañía- Participación en eventos empresariales- Creación de estrategias de posicionamiento de marcas - Evaluación de perfiles empresariales - Gestión de alianzas estrategias y convenios empresariales.- Desarrollo administrativo y organizacionalPERFIL DEL CARGO- Buen manejo de relaciones interpersonales- Facilidad para trabajar con gente - Autonomía y liderazgo- Que tenga dentro de su visión profesional a mediano plazo ocupar cargos gerenciales y directivos REQUISITOS PARA TRABAJO -Excelente equipo de cómputo.-Internet potente.- Plan de datos y llamadas ilimitadas- Excelente expresión verbal.- Presentación personal impecable - Determinado a ser medido por resultados y metas alcanzadas.BENEFICIOS DE LA PROPUESTA- Capacitación constante y permanente para el cargo- Formación Integral para llegar a la gerencia del departamento de mercadeo- Ingresos promedio de $2.000.000  -Vinculación inicial por prestación de servicios, posibilidad de contrato a término indefinido, plan de carrera y ascensos con vinculación laboral definitiva.- Entrenamiento en mentalidad empresarial."
"https://www.computrabajo.com.co/ofertas-de-trabajo/oferta-de-trabajo-de-ejecutivo-dpto-marketing-home-office-barranquilla-en-barranquilla-4DD403A532F1C6AA61373E686DCF3405","Ejecutivo Dpto Marketing - Home Office / Barranquilla","Importante Holding Empresarial con presencia en 9 países a nivel Latinoamérica, abre convocatoria para jóvenes profesionales con el fin de vincularlos a nuestro proyecto empresarial Los seleccionados harán parte del departamento de marketing estratégico y dentro de sus principales funciones tendrá:- El manejo de las relaciones públicas de la compañía- Participación en eventos empresariales- Creación de estrategias de posicionamiento de marcas - Evaluación de perfiles empresariales - Gestión de alianzas estrategias y convenios empresariales.- Desarrollo administrativo y organizacionalPERFIL DEL CARGO- Buen manejo de relaciones interpersonales- Facilidad para trabajar con gente - Autonomía y liderazgo- Que tenga dentro de su visión profesional a mediano plazo ocupar cargos gerenciales y directivos REQUISITOS PARA TRABAJO -Excelente equipo de cómputo.-Internet potente.- Plan de datos y llamadas ilimitadas- Excelente expresión verbal.- Presentación personal impecable - Determinado a ser medido por resultados y metas alcanzadas.BENEFICIOS DE LA PROPUESTA- Capacitación constante y permanente para el cargo- Formación Integral para llegar a la gerencia del departamento de mercadeo- Ingresos promedio de $2.000.000  -Vinculación inicial por prestación de servicios, posibilidad de contrato a término indefinido, plan de carrera y ascensos con vinculación laboral definitiva.- Entrenamiento en mentalidad empresarial."
"https://www.computrabajo.com.co/ofertas-de-trabajo/oferta-de-trabajo-de-lider-de-marketing-home-office-medellin-en-medellin-8B99A0C0C39C25AF61373E686DCF3405","Lider de Marketing - Home Office/ Medellin","Importante Holding Empresarial con presencia en 9 países a nivel Latinoamérica, abre convocatoria para jóvenes profesionales con el fin de vincularlos a nuestro proyecto empresarial Los seleccionados harán parte del departamento de marketing estratégico y dentro de sus principales funciones tendrá:- El manejo de las relaciones públicas de la compañía- Participación en eventos empresariales- Creación de estrategias de posicionamiento de marcas - Evaluación de perfiles empresariales - Gestión de alianzas estrategias y convenios empresariales.- Desarrollo administrativo y organizacionalPERFIL DEL CARGO- Buen manejo de relaciones interpersonales- Facilidad para trabajar con gente - Autonomía y liderazgo- Que tenga dentro de su visión profesional a mediano plazo ocupar cargos gerenciales y directivos REQUISITOS PARA TRABAJO -Excelente equipo de cómputo.-Internet potente.- Plan de datos y llamadas ilimitadas- Excelente expresión verbal.- Presentación personal impecable - Determinado a ser medido por resultados y metas alcanzadas.BENEFICIOS DE LA PROPUESTA- Capacitación constante y permanente para el cargo- Formación Integral para llegar a la gerencia del departamento de mercadeo- Ingresos promedio de $2.000.000  -Vinculación inicial por prestación de servicios, posibilidad de contrato a término indefinido, plan de carrera y ascensos con vinculación laboral definitiva.- Entrenamiento en mentalidad empresarial."
"https://www.computrabajo.com.co/ofertas-de-trabajo/oferta-de-trabajo-de-ejecutivo-de-marketing-home-office-cucuta-en-cucuta-45B6A766ACA59DD161373E686DCF3405","Ejecutivo de Marketing - Home Office// Cucuta","Importante Holding Empresarial con presencia en 9 países a nivel Latinoamérica, abre convocatoria para jóvenes profesionales con el fin de vincularlos a nuestro proyecto empresarial Los seleccionados harán parte del departamento de marketing estratégico y dentro de sus principales funciones tendrá:- El manejo de las relaciones públicas de la compañía- Participación en eventos empresariales- Creación de estrategias de posicionamiento de marcas - Evaluación de perfiles empresariales - Gestión de alianzas estrategias y convenios empresariales.- Desarrollo administrativo y organizacionalPERFIL DEL CARGO- Buen manejo de relaciones interpersonales- Facilidad para trabajar con gente - Autonomía y liderazgo- Que tenga dentro de su visión profesional a mediano plazo ocupar cargos gerenciales y directivos REQUISITOS PARA TRABAJO -Excelente equipo de cómputo.-Internet potente.- Plan de datos y llamadas ilimitadas- Excelente expresión verbal.- Presentación personal impecable - Determinado a ser medido por resultados y metas alcanzadas.BENEFICIOS DE LA PROPUESTA- Capacitación constante y permanente para el cargo- Formación Integral para llegar a la gerencia del departamento de mercadeo- Ingresos promedio de $2.000.000  -Vinculación inicial por prestación de servicios, posibilidad de contrato a término indefinido, plan de carrera y ascensos con vinculación laboral definitiva.- Entrenamiento en mentalidad empresarial."
"https://www.computrabajo.com.co/ofertas-de-trabajo/oferta-de-trabajo-de-marketing-digital-en-bogota-dc-7341B867AB5BDFB161373E686DCF3405","Marketing Digital","Importante empresa Textil esta en búsqueda de personal  que tenga conocimientos en  Marketing Digital con experiencia en redes, que cuente con 1 año de experiencia en el cargo. Debe manejar programas como adobe illustrator, photoshop, suite adobe, google adword, facebook ads, manejo de estrategias en redes y conocimientos de Excel.  de lunes a viernes de 8 am a 5: 30 Pm y los sábados medio día.  Salario: 1.200.000 con prestaciones."
"https://www.computrabajo.com.co/ofertas-de-trabajo/oferta-de-trabajo-de-especialista-en-marketing-bilingue-en-medellin-C7AE7B51DFE9936061373E686DCF3405","Especialista en Marketing - Bilingüe","Reconocida empresa del sector BPO, requiere para su equipo de trabajo Especialista en marketing. Las funcionales principales a desarrollar son: - Gestión de partners, agencias y empresas colaboradoras, normalmente especializadas en áreas más concretas del marketing online.- Implementación del plan de marketing. - Diseño, producción y mantenimiento de contenidos digitales en los distintos medios donde esté presente la compañía. - Gestión y optimización del CRM. Seguimiento, control y evaluación de las campañas publicitarias- Entre otras Requisitos:- Nivel de inglés: 100% (avanzado o nativo)- Mínimo 4 años de experiencia en marketing- Buen manejo de herramientas office .El salario es a convenir según el conocimiento y la experiencia (3.500.000 a 4.500.000)El horario es de lunes a sábado"
"https://www.computrabajo.com.co/ofertas-de-trabajo/oferta-de-trabajo-de-marketing-coordinator-advanced-english-en-bogota-dc-914155DE252867BA61373E686DCF3405","Marketing Coordinator - Advanced English","LEER TODAS LAS CONDICIONES ANTES DE APLICARCompañía de Real Estate  requiere Coordinador de Marketing con experiencia mínima de 4 años con dominio alto del inglés tanto hablado como escrito para ejecutar planes y estrategias de Marketing Tradicional. Requiriéndose como puente de enlace entre proveedores y clientes. Asimismo, asistir en la planificación, implementación y monitoreo de las actividades de Marketing, Branding y Publicidad, a fines de mejorar los procesos del departamento, potencializar la imagen de la marca y de aumentar los clientes potenciales.CONDICIONES:Tipo de Contrato: PRESTACIÓN DE SERVICIOS Salario: $3.750.000 + $250.000 (Bonificación) ( PAGO NETO SIN RETEFUENTE) Sin prestaciones socialesModalidad: Home Office Horario: 9:00am a 6:00pm (Lunes a Viernes) Tipo de Contrato:  PRESTACIÓN DE SERVICIOS"
"https://www.computrabajo.com.co/ofertas-de-trabajo/oferta-de-trabajo-de-omunicador-audiovisual-o-afines-con-integracion-en-marketing-digital--marketing-digital-en-bogota-dc-511FAC198CCAAA0561373E686DCF3405","omunicador Audiovisual o afines con integracion en Marketing digital . - Marketing digital","2 años de experiencia en labores afines al puesto.Manejo de los programas de  Illustrator, Photoshop, Indesing , Premier y After effects / plataformas igitalesCon habilidades en guion/ ortografía"
"https://www.computrabajo.com.co/ofertas-de-trabajo/oferta-de-trabajo-de-auxiliar-contable-jefe-en-medellin-6611A261322FF58B61373E686DCF3405","Auxiliar contable - Jefe","Indispensable manejo CONTAI, 5 años de experiencia en toda la función contable, indispensable conocimiento en tablas dinámicas esenciales para el análisis de datos y la generación de reportes, excelentes conocimientos para realizar la ejecución de los todos los procesos contables de la compañía.Por favor abstenerse de enviar hojas de vida si no cumplen con el perfil indicado.Funciones:•	Nomina: liquidación, registro contable, registro de pago•	Seguridad social: liquidación, registro contable, registro de pago•	Conciliaciones bancarias: cuentas de ahorro, cuentas corrientes, tarjetas de crédito, préstamos bancarios, registros contables de notas débito, intereses, seguros.•	Impuestos: Registro contable, manejo de bases y tarifas en retefuente y reteica, elaboración de iva bimestral con anexos•	Información exógena: experiencia real en elaboración y presentación de información exógena•	Elaboración de facturas de venta: elaboración y registro contable•	Cartera: registro contable de recibos de caja, conciliación de pagos de clientes y su debido registro•	Causación contable: contabilizaciones de compras y gastos con sus retenciones de ley, registro de iva, elaboración y registro de egresos, registro de las retenciones experiencia en manejo e informes con centros de costos•	Excelente memoria, puntual, eficiencia del tiempo, excelente relaciones interpersonales.•	Responsable de la información contable completa 10 días calendario después de terminado el mesHorario lunes a sábado 7:30am a 12:30  mediodía 2:00pm a 5:30pmSalario: $2.000.000  + prestaciones de leyRequerimientosEdad: 25 a 50 añosNivel avanzado de herramientas office (Word y Excel)Ciudad: Medellín"
"https://www.computrabajo.com.co/ofertas-de-trabajo/oferta-de-trabajo-de-desarrollador-fullstack-bilingue-en-bogota-dc-FF281407ACA1439261373E686DCF3405","Desarrollador Fullstack - Bilingüe","Ingeniero de sistemas o carreras afines, bilingüe, con mínimo 2 años de experiencia en el cargo. Debes manejar repositorios (SVN / GIT), diseño y programación orientada a objetos, bases de datos, análisis y diseño de algoritmos. Con conocimientos sólidos en lenguajes de programación de alto nivel como Java, C#, C++, PHP o .NET y conocimientos en HTML5, CSS 3, JavaScript, AJAX y JQUERY; preferiblemente con habilidades en frameworks tipo angular o node y en la construcción de API/RESTful Services. Buscamos que seas una persona proactiva, responsable y apasionada por lo que hace."
"https://www.computrabajo.com.co/ofertas-de-trabajo/oferta-de-trabajo-de-especialista-en-mercadeo-digital-marketing-facebook-google-ads-paid-ads-specialist-ingles-en-bogota-dc-113A643E1F1B0F9461373E686DCF3405","Especialista en Mercadeo digital marketing Facebook + Google Ads - Paid Ads Specialist ingles","Necissitamos Especialista en Marketing Digital, Experiencia real, manejo de campañas, desarrollo de piezas, métricas, inversión, Comunicador publicitario orientado al cliente, trabajo presencial horario de oficina, SEOTRABAJAR DESDE CASA We are seeking a rock star with a lot of expertise and experience of those different areas : PPC, Social Paid Ads, Targeted Display Ads, SEO backlinks generationResponsibilities :Be responsible for improving conversion rates and optimizing campaign results by constantly evaluating the lead lifecycle, journey, and creating new personas and lead profilesParticipate in the planning of engaging social media campaigns (Facebook, Instagram, emails)Optimizing for main and long-tail keywords using the three main pillars of SEO: content, inbound links and on-page attributes.Using a variety of tools to develop a robust keyword universe and run weekly ranking reports.Creating original, high-quality content with proper keyword density, header tags, alt attributes, image naming and meta information.Employing creative white-hat techniques to attract high-quality inbound links with proper anchor text, mix of homepage and deep linking. Perform monthly link disavows.Optimize on-page attributes, including interior linking architecture, H tags, images, meta and proper code markup. Includes optimizing for load speed.Familiarity with the WordPress platform and proper formatting practicesTrack, report, and analyze website analytics and PPC initiatives and campaignsManage campaign expenses, staying on budget, estimating monthly costs and reconciling discrepancies.Perform ongoing keyword discovery, expansion and optimizationResearch and implement search engine optimization recommendationsResearch and analyze competitor advertising linksDevelop and implement link building strategyImplement strategies for PPC Social, paid Search and SEO to drive online traffic to websites, including planning, implementing, managing, reporting and optimizing.Develop, manage and create websites, Blogs and online platforms.Write copy for websites and Blogs, Email CampaignsDesign and write copy for online ads, using appropriate language and codingDaily hands on implementation and campaign management of white hat SEO methodsCreate new and optimize existing landing pages, research/develop keywords and create meta titles and descriptions.Analyze SEO and PPC campaign data and adjust accordingly utilizing tracking and analytics solutions to deliver maximum return.Keep abreast of the latest SEO &amp; SEM industry information and trends.Explore and test new online channels, including the use of Social Media, online video and other interactive measures.Experience writing persuasive search friendly content to traffic.Advanced Knowledge of HTML and experience with popular content Management SystemsStrong knowledge of search engine algorithms and ranking strategies for Google.Landing page conversion optimization (A/B testing, multivariate testing background).Working knowledge of Google web analytic tools.Experience with online display advertising, Email, Web site Analytics and Web site Conversion Metrics (CPM, CTR, CPC,) a plus.Requirements:3 years+ proven SEM experience and success managing PPC campaigns across Google, yahoo &amp; BingProven SEO experienceSolid understanding of performance marketing, conversion, and online customer acquisitionKnowledge of ranking factors and search engine algorithmsUp-to-date with the latest trends and best practices in SEO and SEMWell versed in performance marketing, conversion and online customer acquisitionUp to date with the latest trends and best practices in SEMStrong analytical skills and experience generating SEM reportsFamiliarity with A/B multivariate experimentsStrong communications skills and client facing experienceFluent in the following platforms:Google AdWords, Google Analytics, Bing, Social Media Ads, Facebook Business ManagerWord Press(plus), SEM Rush(plus)Technical expertiseStrong knowledge of tracking website performance including Google Analytics, Tag Manager, FB Audiences, etc.In depth understanding of marketing and ads platforms including Facebook Ads, Google AdWords, etc. (with Certifications).Google application suite (Sheets, Docs, Slides)Experience with A / B testing to drive improved responseWordpress/PHPHTML experienceGreat presentation and data visualization design skillsAdditional Required skills:Must be goal oriented and self-drivenMust be detail orientedSelf-managed and motivatedReliable, on time and willing to walk the extra mileWilling to follow established procedures, but looking to provide input and ideas for improvementExcellent verbal and written communication skillsPerfect English is requiredExperience:4+ years’ experience requiredpaid search management: 3 years (Required)proven SEM: 3 years (Preferred)**Experience:relevant: 3 years (Preferred)SEO: 3 years (Preferred)Web Development: 3 years (Preferred)Social Media Marketing: 2 years (Preferred)Google AdWords: 3 years (Preferred)PPC: 3 years (Preferred)Language:English (Required)Work Location:"
"https://www.computrabajo.com.co/ofertas-de-trabajo/oferta-de-trabajo-de-marketing-digital-en-la-ceja-2DD6E9717B57F59C61373E686DCF3405","marketing Digital","Realizar mantenimiento  de la Pagina web Realizar Fotografia, para la Pagina web  Diseño grafico, para diseños de campañas Manejo del Seo- Sem  para posicionamiento de la Pagina Web y redes sociales"
"https://www.computrabajo.com.co/ofertas-de-trabajo/oferta-de-trabajo-de-qa-specialist-ingles-avanzado-en-bogota-dc-FC22CB455926DB4F61373E686DCF3405","QA Specialist - inglés avanzado","¿Quieres ser parte de la verdadera transformación?En Isobar estamos buscando:Ingeniero(a) de sistemas bilingüe o carreras afines con mínimo 5 años de experiencia laboral, de los cuales 3 años deben ser como QA. Conocimientos sólidos en la definición y ejecución de estrategias de pruebas en aplicaciones móviles y soluciones web, ejecución de pruebas automáticas sobre herramientas como Selenium, Junit, SoapUI, Appium, Azure, GitLab, entre otras y metodologías ágiles (Scrum). Buscamos que seas una persona proactiva, responsable y apasionada por lo que hace.#SomosIsobar"
