"URL","NOMBRE","DESCRIPCION"
"https://www.computrabajo.com.co/ofertas-de-trabajo/oferta-de-trabajo-de-asistente-comercial-y-servicio-al-cliente-marketing-digital-2-anos-experiencia-en-medellin-519D8604AF65031661373E686DCF3405","Asistente comercial y Servicio al cliente Marketing Digital - +2 años experiencia","Buscamos asistente comercial y de servicio al cliente con experiencia +2 años en la comercialización de soluciones informáticas en la nube. Profesional (o estudiante) en Marketing o carreras afines Conocimientos en marketing digital, CRM, ejecución de campañas, Conocimiento en aplicaciones y soluciones en informática. Nivel de ingles intermedio"
"https://www.computrabajo.com.co/ofertas-de-trabajo/oferta-de-trabajo-de-ejecutivo-de-marketing-home-office-cucuta-en-cucuta-45B6A766ACA59DD161373E686DCF3405","Ejecutivo de Marketing - Home Office// Cucuta","Importante Holding Empresarial con presencia en 9 países a nivel Latinoamérica, abre convocatoria para jóvenes profesionales con el fin de vincularlos a nuestro proyecto empresarial Los seleccionados harán parte del departamento de marketing estratégico y dentro de sus principales funciones tendrá:- El manejo de las relaciones públicas de la compañía- Participación en eventos empresariales- Creación de estrategias de posicionamiento de marcas - Evaluación de perfiles empresariales - Gestión de alianzas estrategias y convenios empresariales.- Desarrollo administrativo y organizacionalPERFIL DEL CARGO- Buen manejo de relaciones interpersonales- Facilidad para trabajar con gente - Autonomía y liderazgo- Que tenga dentro de su visión profesional a mediano plazo ocupar cargos gerenciales y directivos REQUISITOS PARA TRABAJO -Excelente equipo de cómputo.-Internet potente.- Plan de datos y llamadas ilimitadas- Excelente expresión verbal.- Presentación personal impecable - Determinado a ser medido por resultados y metas alcanzadas.BENEFICIOS DE LA PROPUESTA- Capacitación constante y permanente para el cargo- Formación Integral para llegar a la gerencia del departamento de mercadeo- Ingresos promedio de $2.000.000  -Vinculación inicial por prestación de servicios, posibilidad de contrato a término indefinido, plan de carrera y ascensos con vinculación laboral definitiva.- Entrenamiento en mentalidad empresarial."
"https://www.computrabajo.com.co/ofertas-de-trabajo/oferta-de-trabajo-de-profesional-marketing-digital-en-bucaramanga-FCBC8B545EA090D361373E686DCF3405","Profesional marketing digital","Reconocida empresa importadora del sector, requiere profesional en marketing digital, debe tener titulo profesional en areas relacionadas y experiencia mínima de 3 anos en gestión de marketing. Salario entre 2.000.000 a 2.500.000 dependiendo del ajuste al perfil."
"https://www.computrabajo.com.co/ofertas-de-trabajo/oferta-de-trabajo-de-asistente-de-marketing-medio-tiempo-y-en-casa-en-cali-D4C93E7575A056D361373E686DCF3405","Asistente de marketing - Medio tiempo y en casa.","Empresa de Estados Unidos, busca para su equipo, una asistente de marketing que se encargara de :  - Soporte en instagram (organizar fotos), engagement.  - Newsletter (mailchimp)  - Subir contenido y actualizar pagina web  - Realizar piezas promocionales para IG y FB  - Encargada de eventos (pieza promocional, crearlos en la Página web, FB, promocion, etc)  - Editar videos con iMovie (super plus)  - Enviar emails  - Asistir administrativa y personalmente a su jefe directo - Otras actividades por asignar por el jefe"
"https://www.computrabajo.com.co/ofertas-de-trabajo/oferta-de-trabajo-de-abogado-administrativo-licitaciones-publicas-en-medellin-5414605004CF48B261373E686DCF3405","Abogado / Administrativo - Licitaciones Publicas","Operador Logístico con 7 años de experiencia dedicado a la planificación, operación y organización de eventos públicos, privados, ferias, congresos y convenciones. Busca joven apasionado por el derecho administrativo para participar en Licitaciones Públicas y ganarlas. Dentro de sus funciones están: perfilar el proceso, estudiar, cotizar, organizar y presentar procesos que salgan en Colombia Compra Eficiente."
"https://www.computrabajo.com.co/ofertas-de-trabajo/oferta-de-trabajo-de-profesional-en-mercadeo-y-publicidad-marketing-digital-analisis-de-datos-en-bucaramanga-088D283D7988F2BA61373E686DCF3405","Profesional en mercadeo y publicidad - Marketing digital análisis de datos","Empresa de servicios públicos, requiere para su equipo de trabajo profesional en Mercadeo y publicidad con conocimiento en Marketing digital, análisis de datos, investigación de mercados, ventas y diseño del producto; para apoyar a la dirección comercial en la generación de estrategias de mercadeo y publicidad,  elaboración de productos y campañas publicitarias, análisis de  información comercial a través de la gestión de información y documentos, informes de gestión y todo tipo insumos para la toma de decisiones y definición de  acciones de mercadeo y ventas."
"https://www.computrabajo.com.co/ofertas-de-trabajo/oferta-de-trabajo-de-disenador-grafico-programadores-profesional-marketing-freelance-en-bucaramanga-422B4AC81758E48861373E686DCF3405","Diseñador grafico - Programadores profesional marketing Freelance","Se solicita personal con experiencia en diseño gráfico, diseño web, programación y marketing integral. Sus funciones se realizaran de manera independiente, freelance y de manera remota. Podrán postularse las personas que cumplan con 1 o mas cargos."
"https://www.computrabajo.com.co/ofertas-de-trabajo/oferta-de-trabajo-de-especialista-en-marketing-digital-en-medellin-4B5B380EB1F6AAA861373E686DCF3405","Especialista en marketing digital","Se requiere profesional en Comunicación Social con experiencia en marketing digital, excelente conocimiento y manejo de facebook ads y google adwords para desarrollar las siguientes actividades: 1. Definir  la estrategia de publicidad digital. 2.Realizar el plan de publicidad digital. 3. Ejecutar el plan de publicidad digital.  4.Analizar datos en Google Analytics para toma de decisiones y afinación de campañas.  5. Conocimiento en Word Press. 6. Realizar campañas en redes sociales, tales como Facebook,  Instagram y whatsapp. 7. Hacer planificación de campañas en Google Adwords. 8. Habilidades de SEO On Page y Off Page. 9. Saber localizar las tendencias. 10. Hacer campañas de SMS. 11. Posicionamiento en RRSS. 12.  Posteo en redes sociales 13. Monitoreo permanente de las diferentes campañas 14. Manejo de Personal.  15. Presentar informes periódicos sobre las actividades desarrolladas y el rendimiento de las campañas Si no tiene conocimiento en las anteriores actividades y manejo de herramientas por favor abstenerse de aplicar,."
"https://www.computrabajo.com.co/ofertas-de-trabajo/oferta-de-trabajo-de-comunicador-social-experto-en-marketing-digital-en-bucaramanga-D8FFF281427E590861373E686DCF3405","Comunicador social - Experto en Marketing Digital","Nos encontramos en búsqueda de Comunicador social con especialización en Marketing Digital con mínimo 3 años de experiencia en el manejo de canales  virtuales, redes sociales y posicionamiento de marca empleadora. excelente redacción. Funciones: gestionar las redes sociales incluyendo la creación de campañas digitales; desarrollo de contenidos para formatos audiovisuales, presentación de vídeos Institucionales y Eventos Salario: 2.600.000Horario: Lunes a Sábado"
"https://www.computrabajo.com.co/ofertas-de-trabajo/oferta-de-trabajo-de-disenadora-grafico-y-marketing-digital-con-experiencia-en-traduccion-de-ingles-a-espanol-en-bogota-dc-5193859BD52F862F61373E686DCF3405","Diseñador/a gráfico y Marketing Digital - con experiencia en traducción de ingles a español","Profesional en Diseño Gráfico con experiencia de 3 a 4 años en: Diseño editorial, diseño comercial y realización de material POP. Indispensable manejo de programas: COREL DRAW, ADOBE PHOTOSHOP y Conocimientos de MARKETING DIGITAL. con muy buen manejo técnico, tipográfico,de redacción y revisión de textos, traducción de Ingles a Español, de fotografía y edición fotográfica. Debe tener capacidad para realizar seguimiento de estas labores y labores de seguimiento a la impresión, .Objetivo del cargo: Desarrollo de labores adecuadas para la comunicación de piezas gráficas y material P.O.P, como complemento esencial manejo de Redes Sociales (Marketing Digital). Utilizando elementos gráficos que expresen los atributos de los productos, servicios o de la campaña a comunicar, garantizando la estética y armonía en el diseño siempre ligados al manual de imagen corporativa."
"https://www.computrabajo.com.co/ofertas-de-trabajo/oferta-de-trabajo-de-ayudante-trade-marketing-experiencia-en-trabajo-pesado-rionegro-en-rionegro-42513CA3721D473461373E686DCF3405","Ayudante trade marketing - Experiencia en trabajo pesado  Rionegro","En Jobandtalent empleamos a más de 15.000 profesionales en toda Colombia y ofrecemos oportunidades de empleo de forma constante para que siempre tengas un empleo a tu disposición. En este momento, estamos contratando AYUDANTE TRADE MARKETING.FUNCIONESEjecutar las instalaciones, movimientos y retiros de activos publicitarios, equipos de frío y estructuras para eventosREQUISITOSExperiencia mínima de 6 meses en en el área logística , en cargue y descargue y trabajo pesado.CONDICIONESBachillerDisponibilidad horaria para trabajar de domingo a domingo, horarios rotativos (mañana, tarde, noche)Salario: $914.000 + aux de transporte + prestaciones"
"https://www.computrabajo.com.co/ofertas-de-trabajo/oferta-de-trabajo-de-coordinador-comercial-en-empresas-de-servicios-de-aseo-o-funerarias-tec-o-tecnologo-en-ventas-mercadeo-marketing-en-bogota-dc-81263A1BE0F7166B61373E686DCF3405","Coordinador comercial en empresas de servicios de aseo o funerarias - tec o tecnologo en ventas  mercadeo  marketing","Importante empresa reconocida requiere con urgencia para su equipo de trabajo mujeres u hombres técnicos o tecnologos en ventas, mercadeo marketing  asesoramiento comercial, con experiencia de 2 años de experiencia  manejando  prestadoras  de servicio, preferiblemente  en el sector  de servicio generales,salario : 1.500.000 + prestaciones de ley + aux transporte •	Asegurado de ventas por 3 meses de 300.000 de ahi en Adelante gana por comisiónhorario : lunes a sabadoSi te encuetras interesada (o) postular hoja de vida"
"https://www.computrabajo.com.co/ofertas-de-trabajo/oferta-de-trabajo-de-marketing-digital-en-bogota-dc-F3A587116B9E6D8461373E686DCF3405","Marketing Digital","Grupo empresarial en el sector de la industria de alimentos busca tecnico y/0 tecnologo en marketing digital con muchas ganas de trabajar, con conocimientos y experiencia comprobada de minimo 2 años, dominio de programas de diseño como illustrator, photoshop y edición de video, también en office básico en excel, conocimientos en fotografía de productos y su edición. Principales responsabilidades • Manejo de Publicidad en Google y Facebook • Administración deRedes sociales (Community Management) • Redacción de Contenidos (Artículos de Blog, infografías, texto páginas web, …) • Optimización SEO, tanto técnico como OnPage y OffPage. • Desarrollo de informes y seguimiento KPI’s digitales. Habilidades y Competencias • Alto nivel de planificación y organización. • Resolutivo(a) y creativo(a). • Alta capacidad analítica y numérica. • Adaptación al entornoHorario:(un dia a la semana se trabaja en la oficina los demas dias en casa, debe contar con el equipo de computo y demas herramnientas que permita en pleno desarrollo de las actividades), que preferiblemente viva en las siguientes localidades, Engativa,Cota,Madrid,Portal 80, Villas de Granada,Gran Granada,siberia, Quirigua y que preferiblemente sea un miembro activo de una iglesia cristiana."
"https://www.computrabajo.com.co/ofertas-de-trabajo/oferta-de-trabajo-de-jefe-de-marketing-enfasis-en-marketing-digital-en-medellin-885E8A7729F4CCF661373E686DCF3405","Jefe de Marketing - Énfasis en Marketing Digital","Empresa dedicada ala comercialización de productos tecnológicos se encuentra en búsqueda de Jefe de Marketing, tenga como mínimo 3 años de experiencia como jefe y/o coordinador del área de marketing.-Diseñar, implementar y supervisar el plan de mercadeo de la empresa.-Realizar eventos corporativos con los clientes y proveedores de la empresa.-Manejar y monitorear las redes sociales de la empresa desde la estrategia digital.-Coordinar la creación de contenidos en diversos formatos; artículos, vídeos, fotos y, en un nivel más avanzado, también ebooks, guías, webinars, etc, -Aumentar la visibilidad de la marca en medios online y offline, y en la mejora de esta frente a los clientes, así como la consecución de una mejor reputación online.-Realizar análisis y seguimiento de las principales acciones y estrategias de la competencia en el ámbito del marketing digital.-Generar alianzas estratégicas con aplicaciones y websides que ayuden a la implementación de nuevas acciones que impulsen la marca de compañía."
"https://www.computrabajo.com.co/ofertas-de-trabajo/oferta-de-trabajo-de-coordinador-trade-marketing-experiencia-en-cosumo-masivo-contrato-a-termino-indefinido-con-la-empresa-en-yumbo-97B17583030BF18461373E686DCF3405","Coordinador Trade Marketing experiencia en cosumo masivo - Contrato a Termino Indefinido con la empresa","Creación, desarrollo, ejecución, control, seguimiento y evaluación de actividades de las marcas asignadas, velando por el logro de los objetivos en volumen e impactos. / Creación y desarrollo de material pop asignado para las marcas asignadas de acuerdo a estrategia corporativa./Apoyo en la fijación de precios de las marcas a cargo./ Recopilación de chequeo de precios de competencia y marcas a cargo para análisis de la categoría./ Investigación y revisión del mercado de las categorías a cargo del micro y macro entorno./Supervisión de ejecución de material pop, desde el envió hasta la implementación./ Análisis de costos de actividades a ejecutar, implicación en el margen del grupo corporativo./ Apoyo en el desarrollo del canal e-commerce y digital de la compañía./ Supervisión del área de diseño./ Apoyo en la revisión de documentos relacionado con contratos de nuevos proveedores./ Revisión de productos fecha corta y baja rotación a nivel general, generando propuestas de evacuación./ Desarrollo de actividades de endomarketing.NOTA: si no cumple al 100% con los requisitos su hoja de vida no sera tenida en cuenta-"
"https://www.computrabajo.com.co/ofertas-de-trabajo/oferta-de-trabajo-de-analista-de-marketing-bilingue-en-bogota-dc-8174A274CAABFAB961373E686DCF3405","analista de Marketing - bilingue","Importante outsorsing requiere para su equipo de trabajo analista de marketing,  esta persona se encargará de crear y colaborar con el Gerente Senior de Marca en todas las tareas operativas para entregar resultados estratégicos. Ejecuta tareas de marketing y actividades operativas que respaldan los planes. Ejecuta iniciativas de marketing en apoyo de estrategias a largo plazo a través del liderazgo del equipo de la unidad de negocios. , Relaciones con los proveedores del cliente y el grupo de desembolso de AP que maneja todos los desembolsos de cheques y pagos, y asuntos relacionados con impuestos.Contrato: Por dos meses Salarion: 2000000+prestaciones de ley  * dos meses (inicialmente)Horario: Lunes a Sabado"
"https://www.computrabajo.com.co/ofertas-de-trabajo/oferta-de-trabajo-de-profesional-de-marketing-en-manizales-A0AD500B716A91A961373E686DCF3405","Profesional de marketing","En Confa trabajamos cada día por un mundo mejor, por eso elegimos personas como tú, talentosas, competentes y listas para dar lo mejor de sí en esta Caja de Compensación.Estamos buscando Profesional de marketing.Educación: Profesionales en mercadeo, comunicación,  administración o afines, con posgrado en marketing digitalExperiencia: Entre 2 y 3 años en marketing digital, el desarrollo de campañas digitales exitosas, administración de estadísticas digitales.Condiciones contractuales: Contrato laboral a término fijo.Horario: Lunes a ViernesSalario:$ 2.074.700"
"https://www.computrabajo.com.co/ofertas-de-trabajo/oferta-de-trabajo-de-lider-creativo-profesional-en-areas-de-marketing-y-diseno-en-bucaramanga-AE72B18A80BD0EA261373E686DCF3405","Líder Creativo - Profesional en áreas de Marketing y Diseño","Empresa del sector gráfico y publicitario busca para su equipo de trabajo LÍDER CREATIVO para el diseño de conceptos, propuestas, estrategias, soluciones y alternativas creativas en las comunicaciones de la empresa y sus clientes. Que tenga la capacidad de analizar rápidamente su entorno para generar conceptos actuales y de tendencia que puedan ser potencializados en las estrategias de comunicación. Recibir información de parte de los clientes y lo traducirlos a campañas con  sus respectivas fases y sugerencias de contenidos. Diseñar, crear, ejecutar y realizar análisis de campañas publicitarias en plataformas digitales (Facebook ads, Instagram Ads, Google Adwords, entre otras) manejo de Plataformas de Diseño: Suite de Adobe (Photoshop Illustrator, InDesign) programas de edición (Premier, After Effects, Video Deluxe, entre otros) trabajo en equipo, entender y aprovechar las fortalezas de cada uno de los miembros para asignar los recursos a los proyectos de forma eficiente. Mantener una constante comunicación con clientes estableciendo una comunicación basada en la empatía, generando soluciones a los requerimientos del cliente. Experiencia mínima de 2 años, ser autónomo y proactivo para el desarrollo de las actividades.Horario de Oficina / Ingresos 1.400.000 entre básico y bonificaciones"
"https://www.computrabajo.com.co/ofertas-de-trabajo/oferta-de-trabajo-de-director-comercial-venta-de-procesos-de-talento-humano-en-bogota-dc-5EA4241EA93900FF61373E686DCF3405","Director Comercial - Venta de procesos de Talento Humano","Importante compañía lnternacional requiere Directores, Asesores o Ejecutivos comerciales Freelance, que cuente con portafolio propio de clientes  a los cuales haya ofrecido y cerrado negocios en  la venta de servicios de Recursos humanos como lo es: ( Administración de nomina, administración de personal, selección de personal, dotación, procesos de capacitaciones, entre otros), debe también realizar seguimiento  a la facturación y el pago de las mismas."
"https://www.computrabajo.com.co/ofertas-de-trabajo/oferta-de-trabajo-de-analista-de-data-y-marketing-digital-bogota-en-bogota-dc-3A4F35BEA009699B61373E686DCF3405","Analista de data  y Marketing digital - Bogotá","Cargo: Analista de Data  y Marketing Digital.Somos una empresa social que presta atención integral (educación, nutrición y cuidado) de calidad para la primera infancia en Colombia y acompañamos a otras entidades en la mejora en la calidad de la educación.¡Haz parte de nuestro equipo aeioTU! Y acompañemos a otros a mejorar la calidad en la educación que se caracteriza por acompañar a los niños a encontrar el sentido de la vida y de las cosas de manera natural y alegre. Construyamos conocimientos, habilidades y competencias.Objetivo del cargo: Apoyar, crear y desarrollar estrategias del área digital de la organización, para posicionar los productos y servicios de la unidad de negocio y redes sociales.Profesión: Publicista o Mercadeo.Funciones: Crear, desarrollar y medir los resultados de estrategias de marketing digital para posicionar los productos y servicios de la unidad de negocio.Requisitos: Conocimiento y experiencia de 1 – 2 años en el manejo de estrategias de posicionamiento en redes sociales, SEO, Inbound marketing, Email Marketing y Remarketing. Experiencia: De 1 – 2 años en desarrollo de campañas publicitarias con Google Ads, Facebook Ads e Instagram Ads. Conocimiento y manejo de Google Analytics.Salario: $1.920.300.Contrato: Termino fijo  hasta el 31 de diciembre de 2020."
"https://www.computrabajo.com.co/ofertas-de-trabajo/oferta-de-trabajo-de-tecnologo-en-marketing-digital-en-medellin-10C0AC0BB86C277161373E686DCF3405","Tecnologo en Marketing Digital","Responsable	de la gestión,	desarrollo e incremento	de la comunidad	online,	creando	y gestionando	contenidos que humanicen la marca.Conocimientos online: eMail Marketing, Redes Sociales, SEO, SEM, SMM, RTB, Afiliación, Display, Inbound/Outbound, Social Media, CRM, Community Management, Branding online, UX (usabilidad), Mobile Marketing, conocimientos generales de programación y/o CMS (wordpress, joomla, html5, etc)."
"https://www.computrabajo.com.co/ofertas-de-trabajo/oferta-de-trabajo-de-asesor-experto-marketing-digital-y-online-en-cali-FB6DAE65CA41712561373E686DCF3405","Asesor experto Marketing Digital y online","Vendedor  experto en Marketing Digital y ventas, experiencia en planeación , control , seguimiento , manejo y actualización de plataformas , seguimiento del canal , manejo de indicadores, alta creatividad , experiencia  , cumplimiento presupuesto de ventas , con experiencia , salario básico más comisiones por cierre de ventas efectivas"
"https://www.computrabajo.com.co/ofertas-de-trabajo/oferta-de-trabajo-de-coordinador-comercial-en-empresas-de-servicios-de-aseo-o-funerarias-tec-o-tecnologo-en-ventas-mercadeo-marketing-en-bogota-dc-A6D8FE6D8077A65961373E686DCF3405","Coordinador comercial en empresas de servicios de aseo o funerarias - tec o tecnologo en ventas  mercadeo  marketing","Importante empresa reconocida requiere con urgencia para su equipo de trabajo mujeres u hombres técnicos o tecnologos en ventas, mercadeo marketing  asesoramiento comercial, con experiencia de 2 años de experiencia  manejando  prestadoras  de servicio, preferiblemente  en el sector  de servicio generales,salario : 1.500.000 + prestaciones de ley + aux transporte •	Asegurado de ventas por 3 meses de 300.000 de ahi en Adelante gana por comisiónhorario : lunes a sabadoSi te encuetras interesada (o) postular hoja de vida"
"https://www.computrabajo.com.co/ofertas-de-trabajo/oferta-de-trabajo-de-ejecutivo-de-cuenta-freelance-venta-de-procesos-de-talento-humano-en-bogota-dc-4244288B32F8B63461373E686DCF3405","Ejecutivo de Cuenta Freelance - Venta de procesos de Talento Humano","Importante compañía lnternacional requiere Asesores comerciales Freelance como tu, que cuente con portafolio propio de clientes  a los cuales haya ofrecido y cerrado negocios en  la venta de servicios de Recursos humanos como lo es: ( Administración de nomina, administración de personal, selección de personal, dotación, procesos de capacitaciones, entre otros), debe también realizar seguimiento  a la facturación y el pago de las mismas."
"https://www.computrabajo.com.co/ofertas-de-trabajo/oferta-de-trabajo-de-analista-marketing-digital-experiencia-analisis-metrica-mercado-y-competencia-en-medellin-4E4B2754470D51AE61373E686DCF3405","Analista Marketing digital - Experiencia análisis métrica mercado y competencia","Se requiere profesional analista Marketing digital: profesional en áreas afines a mercadeo con experiencia de más de 3 años realizando análisis de métricas, de mercado y competencia, branding y análisis de  landing pages,  SEM Y SEO, Seguimiento a LEADS, Manejo de Google Adwords, Google Analytics, Google Search Console, Google Trends, Manejo de Wordpress, conocimiento de Pautas en social Media."
"https://www.computrabajo.com.co/ofertas-de-trabajo/oferta-de-trabajo-de-analista-de-marketing-digital-en-medellin-en-medellin-56C109FD4A16998361373E686DCF3405","Analista de Marketing Digital - En Medellín","Somos una empresa de tecnología, llevamos 11 años en el mercado y trabajamos para llevar una educación de calidad a toda Colombia y también a algunos países de América Latina, a través de la implementación de plataformas educativas y aulas virtuales.REQUISITOS MÍNIMOS:•	Ser tecnólogo o profesional en Marketing digital, Publicidad, comunicación, diseño o carreras afines.•	2 años de experiencia en manejo de Google Analytics y Google Adwords•       2 años de experiencia en Administración y optimización de SEO•	2 años de experiencia en planificación de estrategias SEM.•	1 año de experiencia en Manejo de Redes Sociales•	Tener muy buena presentación personal•	Estar radicado(a) en MedellínACTIVIDADES A DESARROLLAR:•	Definición, implementación y seguimiento de estrategias SEO y SEM•	Elaboración de informes mensuales (Pautas digitales y KPI´s)•	Monitoreo y seguimiento de campañas•	Seguimiento y mejora del SEO.•	Planteamiento y ejecución de campañas de SEM.•	Gestión de presupuestos.•	Crear, definir e implementar el Plan de Marketing para el canal online.•	Medir y analizar la rentabilidad de las acciones de Marketing realizadas.•	Experiencia en mejora y posicionamiento marca, sitio web."
