"URL","NOMBRE","DESCRIPCION"
"https://www.computrabajo.com.co/ofertas-de-trabajo/oferta-de-trabajo-de-ejecutivo-de-marketing-home-office-en-bogota-dc-91748B0CCA3DAB2E61373E686DCF3405","Ejecutivo de Marketing Home Office","Multinacional dedicada a la prestación de servicios educativos busca profesional graduado o en proceso de grado para laborar en el departamento comercial. Las funciones a desempeñar son: captación de prospectos, proceso de evaluación del presupuesto de publicidad y apertura de mercados.Es importante que la persona que se postule tenga excelentes habilidades comunicativas, sea pro activo, creativo y esté en la disposición de aprender.La compañía brinda opción plan carrera, capacitación constante en temas de marketing y liderazgo,  excelentes ingresos económicos que van acorde al cumplimiento de objetivos y oportunidad de traslado internacional.Requisitos: Residir en Bogotá, contar con WIFI en casa y línea telefónica ilimitadaNota: por favor abstenerse de aplicar a la oferta si no cumple los requisitos. el proceso de entrevista sera realizado de manera virtual"
"https://www.computrabajo.com.co/ofertas-de-trabajo/oferta-de-trabajo-de-aprendiz-marketing-o-afines-en-bogota-dc-996E83CFCAA9DB9C61373E686DCF3405","Aprendiz Marketing o afines","Importante empresa de tecnología se encuentra en la búsqueda de un practicante técnico o tecnológo en áreas de marketing, diseñadores, publicidad, o afines quien brindara apoyo en la construcción de comunicaciones internas del área de Recursos Humanos de la compañia.Condiciones laboralesSalario: 100% SMLV Afiliaciones: ARL y EPSHorario de trabajo: Lunes a viernesLugar de trabajo: NorteTener en cuenta que para aplicar a esta vacante solo se tendrán en cuenta perfiles técnicos o tecnologos (Profesionales NO)"
"https://www.computrabajo.com.co/ofertas-de-trabajo/oferta-de-trabajo-de-especialista-marketing-digital-experiencia-en-pymes-en-bogota-dc-8877E017ED2A267461373E686DCF3405","Especialista Marketing Digital / Experiencia en Pymes","Importante compañía de publicidad  y Mercadeo requiere para su equipo de trabajo Especialista Digital:Salario. $1.600.000 + Todas las prestacione de ley.Horario: Lunes a viernes 7:45 a 6:00 pm y el sábado medio día.Lugar de Trabajo: Cafam Floresta Centro Comercial Nivel de Estudios: Mercadólogo,  Publicista (o carrera afín) . Estudios profesionales culminados y con soporte.Requisitos: EXPERIENCIA DE 1 AÑO EN: Conocimiento y manejo demostrable de Google Ads y Facebook Ads, experiencia en asesoría de pymes, Experiencia como planner de campañas digitales, manejo de presupuestos, inversiones, etcLas personas interesadas y que cumplan con el perfil aplicar a la oferta para programar proceso de selección virtual."
"https://www.computrabajo.com.co/ofertas-de-trabajo/oferta-de-trabajo-de-coordinador-comercial-en-empresas-de-servicios-de-aseo-o-funerarias-tec-o-tecnologo-en-ventas-mercadeo-marketing-en-bogota-dc-81263A1BE0F7166B61373E686DCF3405","Coordinador comercial en empresas de servicios de aseo o funerarias - tec o tecnologo en ventas  mercadeo  marketing","Importante empresa reconocida requiere con urgencia para su equipo de trabajo mujeres u hombres técnicos o tecnologos en ventas, mercadeo marketing  asesoramiento comercial, con experiencia de 2 años de experiencia  manejando  prestadoras  de servicio, preferiblemente  en el sector  de servicio generales,salario : 1.500.000 + prestaciones de ley + aux transporte •	Asegurado de ventas por 3 meses de 300.000 de ahi en Adelante gana por comisiónhorario : lunes a sabadoSi te encuetras interesada (o) postular hoja de vida"
"https://www.computrabajo.com.co/ofertas-de-trabajo/oferta-de-trabajo-de-ejecutivo-de-marketing-en-pereira-66AFB9ED1FCC827761373E686DCF3405","Ejecutivo de Marketing","Somos una organización centrada en la gente. Nuestro propósito es impactar positivamente la vida de todas y cada una de las personas con las que nos relacionamos. Es por eso, que estamos en la búsqueda de nuevos talentos que apoyen nuestro ambicioso proyecto de expansión  a través de un excelente desempeño en el área de marketing y gestión comercial. Tu misión será dar a conocer todos los beneficios de nuestra marca, para así impulsar la vinculación de nuevos usuarios, dado el gran aumento que ha tenido la educación online en los últimos meses.Si eres seleccionado nuestro compromiso será: •	Capacitación constante y acompañamiento a tu trabajo•	Excelente plan de ingresos + premios e incentivos por tu excelente desempeño•       Ingreso promedio mensual $2'300.000•	Oportunidades de ascenso en corto plazo•	Posibilidad de ser contratado por la organización, con todos los beneficios de ley, cumpliendo indicadores de gestión.Requisitos:•	Profesionales de las carreras de Administración, Marketing, Ingeniería Industrial o afines al área comercial•	Tener un computador para trabajar en casa•	Buena conexión a Internet•	Espacio adecuado para trabajar desde casa.•	Disponibilidad inmediata para trabajar a tiempo completo.Nuestros procesos de selección están orientados a seleccionar a los mejores. Por tal motivo requerimos que cuentes con la disposición de tiempo suficiente, A PARTIR DEL 11 DE MAYO, para conocerte, evaluar tus competencias, y que tengas la oportunidad de conocer a fondo nuestro esquema laboral."
"https://www.computrabajo.com.co/ofertas-de-trabajo/oferta-de-trabajo-de-marketing-digital-en-bogota-dc-F3A587116B9E6D8461373E686DCF3405","Marketing Digital","Grupo empresarial en el sector de la industria de alimentos busca tecnico y/0 tecnologo en marketing digital con muchas ganas de trabajar, con conocimientos y experiencia comprobada de minimo 2 años, dominio de programas de diseño como illustrator, photoshop y edición de video, también en office básico en excel, conocimientos en fotografía de productos y su edición. Principales responsabilidades • Manejo de Publicidad en Google y Facebook • Administración deRedes sociales (Community Management) • Redacción de Contenidos (Artículos de Blog, infografías, texto páginas web, …) • Optimización SEO, tanto técnico como OnPage y OffPage. • Desarrollo de informes y seguimiento KPI’s digitales. Habilidades y Competencias • Alto nivel de planificación y organización. • Resolutivo(a) y creativo(a). • Alta capacidad analítica y numérica. • Adaptación al entornoHorario:(un dia a la semana se trabaja en la oficina los demas dias en casa, debe contar con el equipo de computo y demas herramnientas que permita en pleno desarrollo de las actividades), que preferiblemente viva en las siguientes localidades, Engativa,Cota,Madrid,Portal 80, Villas de Granada,Gran Granada,siberia, Quirigua y que preferiblemente sea un miembro activo de una iglesia cristiana."
"https://www.computrabajo.com.co/ofertas-de-trabajo/oferta-de-trabajo-de-coordinador-de-marketing-digital-zipaquira-en-zipaquira-8219FC66A4C0EE1461373E686DCF3405","Coordinador de Marketing digital - Zipaquira","Importante compañía de Alimentos, se encuentra en la búsqueda de Coordinador de Marketing digital con experiencia mínima de 3 años certificada en el manejo de canales digitales, para encargarse de la marca específica, con conocimiento en consumo masivo, ventas en línea, encargada de las comunicaciones para publicidad en redes sociales, seguimiento a clientes asesorías en mercadeo publicidad, promocionar y publicar los diferentes servicios que brinda la compañía, definir estrategias de comercialización, diseño de campañas nuevas e innovación de producto, seguimiento y acompañamiento a clientes Debe ser profesional en Publicidad, Marketing digital y/o afines Horario de trabajo: De lunes a viernes de 8:00 a.m. a 5:30 p.m. y sábados de 8:00 a.m. a 12:30 p.m.Si cumple con el perfil envie su hoja de vida actualizada"
"https://www.computrabajo.com.co/ofertas-de-trabajo/oferta-de-trabajo-de-ejecutivo-comercial-cuentas-clave-experiencia-en-empresas-de-marketing-y-publicidad-en-bogota-dc-5A82556B4745F02961373E686DCF3405","Ejecutivo comercial  cuentas clave - Experiencia en Empresas de Marketing y Publicidad","importante empresa del sector Marketing, requiere para su equipo de trabajo ejecutivo comercial de cuentas claves, que cuente con experiencia minima de 3 años en empresas de Marketing y publicidad, en cargos comerciales de cuentas corporativas. debe ser profesional en administración de empresas, mercadeo o carreras afines, indispensable que haya manejado cumplimiento de ventas de mas de 200 millones anuales. para laborar de lunes a viernes de 7:30 a 5:30 un sábado cada 15 días medio día.salario 2´000000+ 400 mil de auxilio extralegal + celular + comisiones.  Interesados por favor postularse a la vacante, nos pondremos en contacto con usted."
"https://www.computrabajo.com.co/ofertas-de-trabajo/oferta-de-trabajo-de-profesional-marketing-digital-en-bogota-dc-FD80F1720400510961373E686DCF3405","Profesional Marketing Digital","Profesional en marketing digital, comunicación social,diseño gráfico,publicidad y mercadeo  o carreras a fines.Experiencia en manejo de redes sociales, creación de piezas gráficas en función de generar contenido para redes sociales y pagina web. Experiencia certificada  en cargo de Community manager y diseñador gráfico."
"https://www.computrabajo.com.co/ofertas-de-trabajo/oferta-de-trabajo-de-ejecutivo-de-marketing-home-office-comercial-en-bogota-dc-07BC9B9F484A652F61373E686DCF3405","Ejecutivo de Marketing Home Office - Comercial","Multinacional dedicada a la prestación de servicios educativos busca profesional graduado o en proceso de grado para laborar en el departamento comercial. Las funciones a desempeñar son: captación de prospectos, proceso de evaluación del presupuesto de publicidad y apertura de mercados.Es importante que la persona que se postule tenga excelentes habilidades comunicativas, sea pro activo, creativo y esté en la disposición de aprender.La compañía brinda opción plan carrera, capacitación constante en temas de marketing y liderazgo,  excelentes ingresos económicos que van acorde al cumplimiento de objetivos y oportunidad de traslado internacional.Requisitos: Residir en Bogotá, contar con WIFI en casa y línea telefónica ilimitada"
"https://www.computrabajo.com.co/ofertas-de-trabajo/oferta-de-trabajo-de-jefe-de-marketing-enfasis-en-marketing-digital-en-medellin-885E8A7729F4CCF661373E686DCF3405","Jefe de Marketing - Énfasis en Marketing Digital","Empresa dedicada ala comercialización de productos tecnológicos se encuentra en búsqueda de Jefe de Marketing, tenga como mínimo 3 años de experiencia como jefe y/o coordinador del área de marketing.-Diseñar, implementar y supervisar el plan de mercadeo de la empresa.-Realizar eventos corporativos con los clientes y proveedores de la empresa.-Manejar y monitorear las redes sociales de la empresa desde la estrategia digital.-Coordinar la creación de contenidos en diversos formatos; artículos, vídeos, fotos y, en un nivel más avanzado, también ebooks, guías, webinars, etc, -Aumentar la visibilidad de la marca en medios online y offline, y en la mejora de esta frente a los clientes, así como la consecución de una mejor reputación online.-Realizar análisis y seguimiento de las principales acciones y estrategias de la competencia en el ámbito del marketing digital.-Generar alianzas estratégicas con aplicaciones y websides que ayuden a la implementación de nuevas acciones que impulsen la marca de compañía."
"https://www.computrabajo.com.co/ofertas-de-trabajo/oferta-de-trabajo-de-trade-marketing-en-bogota-dc-C79B86DFD22E543861373E686DCF3405","Trade Marketing","Somos Una Multinacional sector  Salud en búsqueda de Grandes  Profesionales   en Optómetra, Publicista, Diseñador Gráfico, Profesional en Mercadeo, Administrador de empresas con estudios o experiencia en mercadeo  con experiencia certificada mínimo de 3 años en cargos de responsabilidad de Trade Marketing y/o Cargos de responsabilidad en mercadeo, con experiencia en manejo de marcas premium y comunicación de temas Salud (idealmente en Óptica, Oftalmología o áreas de Salud)Conocimiento de Marketing estratégico, Cursos de actualización en análisis de mercados, Análisis del consumidor, Ventas, Marketing digital, Manejo suite de Adobe, Manejo de inglés (escrito y hablado), Excel y PowerPoint.Nivel de Ingles Avanzado Contratación directa con la compañía,  Salario según experiencia entre $ 4.000.000 a $ 4.500.000.Solo tendremos en cuenta si cumples con la experiencia y perfil requerido  Puedes remitir tu Perfil al correo  multinacionaloptica2020 Gmail.com  y en el Asunto colocar cargo Trade MarketingBuscamos  contar con todo tu Talento!!"
"https://www.computrabajo.com.co/ofertas-de-trabajo/oferta-de-trabajo-de-gerente-marketing-digital-en-cali-1388EED69347A92F61373E686DCF3405","Gerente Marketing Digital","Importante empresa productora y comercializadora de productos de consumo masivo se encuentra en la búsqueda de un gerente de marketing digital. Hombre o mujer con más de tres años experiencia en el diseño, desaarrollo e implementación de estrategias digitales articuladas con motores de búsqueda como Google y redes sociales FB, IG, entre otras. Con experiencia en conformación y dirección de equipos de diseñadores, community managers, asesores comerciales. Con conocimiento en Analitics, KPI’s digitales, mucho liderazgo y alta orientación al resultado."
"https://www.computrabajo.com.co/ofertas-de-trabajo/oferta-de-trabajo-de-asistente-tecnico-textil-turno-rotativo-en-medellin-EA7DFECF214C943F61373E686DCF3405","Asistente Técnico Textil - Turno rotativo","Importante empresa del sector textil – Confección requiere Asistente Técnico Confección, Requiere que manejen maquinaría de confección Objetivo del Cargo: Garantizar el control de calidad de los productos, elaboración de montajes de las maquinas de confección y de brindar los métodos y tiempos asignados a la confección de prendas.Hacer los análisis y determinar la viabilidad de productos terminados.Realizar análisis y seguimiento del proceso.Experiencia: 2 años como asistente en control calidad o en métodos y tiempos. Es fundamental que maneje las maquinas de confección y realice montajesFormación: Estudios en Tecnología de producción, calidad o confección Industrial.Horario: turno rotativo"
"https://www.computrabajo.com.co/ofertas-de-trabajo/oferta-de-trabajo-de-profesional-en-marketing-digital-en-bogota-dc-62B66C00F6E780A461373E686DCF3405","Profesional en Marketing Digital","Buscamos profesional en Comunicación, Mercadeo, Administración o afines, que tenga conocimientos y experiencia en mercadeo digital, manejo de clientes (preferiblemente si ha estado en agencia digital). Que sea estructurada y que actué como project manager haciendo que las cosas pasen, que entienda de pauta digital y como generar conversiones para los clientes y lograr su satisfacción. Buscamos una persona curiosa, estructurada, propositiva, que le guste aprender. Todo terreno y que se le mida a los retos de un startup. Nivel de Inglés: Intermedio. Ofrecemos: Home Office, contrato directo y oportunidades de crecimiento."
"https://www.computrabajo.com.co/ofertas-de-trabajo/oferta-de-trabajo-de-jefe-de-trade-marketing-bogota-en-bogota-dc-1F68B07E78ACABEB61373E686DCF3405","Jefe de Trade Marketing / Bogotá","Reconocida multinacional requiere para su equipo de trabajo profesional en Ingeniería Industrial, Administración de Empresas o Mercadeo, mínimo de 3 a 5 años de experiencia en manejo de estrategias de marketing ventas y comercio, PLANEACIÓN, DIRECCIONAMIENTO, CUMPLIMIENTO DE METAS y ejecución de planes de trade-marketing, manejo de indicadores de gestión y experiencia de manejo de operación en calle.Funciones: Mantener la relación con clientes, definir estrategia de puntos de venta, organizar y coordinar el sistema de puntos de venta.Persona con orientación al detalle, liderando equipos de trabajo, asegurando alta satisfacción del servicio que brinde a sus clientes, capacidad para trabajar en equipoIndispensable Inglés: Avanzado Manejo avanzado de Excel y herramientas Microsoft Office Habilidades de gestión efectiva del tiempo.Salario: $ 6.000.000"
"https://www.computrabajo.com.co/ofertas-de-trabajo/oferta-de-trabajo-de-marketing-digital-generador-de-trafico-experiencia-en-pauta-publicitaria-en-bogota-dc-C90AC29B25E27B7F61373E686DCF3405","Marketing Digital Generador de Tráfico - Experiencia en pauta publicitaria","Hola, estamos buscando una persona para completar nuestro equipo de mercadeo, somos una empresa de desarrollo de plataformas web B2B.- El reto:Queremos tener un crecimiento en el volumen de clientes y usuarios de nuestros servicios tanto en Colombia como en otros países de américa latina.- Tu experiencia:Esperamos que hayas manejado campañas publicitarias en diferentes medios como facebook, linkedin, google ads y youtube, que tengas una basta experiencia optimizando campañas para la generación de leads, con presupuestos superiores a 5 millones mensuales.Requerimos que tengas experiencia en campañas tipo inbound marketing y que manejes la filosofía de embudos para cautivar, nutrir, calificar y convertir leads.También es indispensable que hayas manejando herramientas de marketing automation como Mautic, Infusionsoft, ActiveCampaign o Aweber u otras especialmente en el manejo de flujos automatizados de comunicaciones o campañas.Es importante que manejes wordpress para el desarrollo de landing pages.- Tus estudios:Profesional en Mercadeo, Publicidad, Comunicación social o diseño gráfico.Estudios en marketing digital.Estudios y experiencia en las plataformas de Ads de facebook, linkedin y google.Inglés nivel intermedio - avanzado demostrable.- Ofrecemos:Contrato laboral a término indefinido, prestaciones de ley, bonificaciones por ventas electrónicas y cumplimiento de metas.Si cuentas con la experiencia requerida aplica."
"https://www.computrabajo.com.co/ofertas-de-trabajo/oferta-de-trabajo-de-coordinador-trade-marketing-experiencia-en-cosumo-masivo-contrato-a-termino-indefinido-con-la-empresa-en-yumbo-97B17583030BF18461373E686DCF3405","Coordinador Trade Marketing experiencia en cosumo masivo - Contrato a Termino Indefinido con la empresa","Creación, desarrollo, ejecución, control, seguimiento y evaluación de actividades de las marcas asignadas, velando por el logro de los objetivos en volumen e impactos. / Creación y desarrollo de material pop asignado para las marcas asignadas de acuerdo a estrategia corporativa./Apoyo en la fijación de precios de las marcas a cargo./ Recopilación de chequeo de precios de competencia y marcas a cargo para análisis de la categoría./ Investigación y revisión del mercado de las categorías a cargo del micro y macro entorno./Supervisión de ejecución de material pop, desde el envió hasta la implementación./ Análisis de costos de actividades a ejecutar, implicación en el margen del grupo corporativo./ Apoyo en el desarrollo del canal e-commerce y digital de la compañía./ Supervisión del área de diseño./ Apoyo en la revisión de documentos relacionado con contratos de nuevos proveedores./ Revisión de productos fecha corta y baja rotación a nivel general, generando propuestas de evacuación./ Desarrollo de actividades de endomarketing.NOTA: si no cumple al 100% con los requisitos su hoja de vida no sera tenida en cuenta-"
"https://www.computrabajo.com.co/ofertas-de-trabajo/oferta-de-trabajo-de-analista-trade-marketing-junior-sector-de-alimentos-en-bogota-dc-A2AFB1B7F23B9E5861373E686DCF3405","analista trade marketing junior sector de alimentos","Reconocida empresa del sector de alimentos requiere para su equipo de trabajo  analista de marketing con experiencia de dos años en el cargo manejando elaboración, seguimiento y analisis de actividades , desarrollo de canales y propuestas de mejoras de indicadores PREFERIBLEMETE DEL SECTOR DE ALIMENTOSEstudio:Tecnologo o estudiante de ultimo semestre no profesionalSalario: 1500000 + todo lo de leyHorario Lunes a viernes y sabados"
"https://www.computrabajo.com.co/ofertas-de-trabajo/oferta-de-trabajo-de-tecnico-analista-de-marketing-digital-en-medellin-0F8951911D1039BD61373E686DCF3405","Técnico Analista de marketing digital","Estamos buscando técnico, tecnólogo o profesional para desempeñarse como Analista de Marketing Digital. Personas Creativas, Apasionadas por el Mercadeo y el Marketing Digital, Orientadas al servicio y al Logro de objetivos, Amables, Cordiales, de Excelentes relaciones interpersonales y con Buena Presentación Personal. Requisitos Mínimos: • Nivel de Estudio: técnicos, tecnólogo o profesional en Mercadeo, Marketing digital o carreras afines. • Manejo de Google Analytics y Google Adwords • Administración y optimización de SEO, planeación de estrategias SEM. • Manejo de Redes sociales • Buena presentación personal • Radicado en Medellín • Experiencia de 1 año en manejo de herramientas mencionadas anteriormente. Actividades a Desarrollar: • Definición, implementación y seguimiento de estrategias SEO y SEM • Elaboración de informes mensuales (Pautas digitales y KPI´s) • Monitoreo y seguimiento de campañas • Seguimiento y mejora del SEO. • Planteamiento y ejecución de campañas de SEM. • Gestión de presupuestos. • Crear, definir e implementar el Plan de Marketing para el canal online. • Medir y analizar la rentabilidad de las acciones de Marketing realizadas. • Experiencia en mejora y posicionamiento marca, sitio web. Salario: 1.800.000 más prestaciones legales Horario: lunes a viernes 8:00am 5:30pm sábados 8:00am 12:00pm Tipo contrato: Indefinido Lugar de trabajo: Medellin (en este momento teletrabajo)"
"https://www.computrabajo.com.co/ofertas-de-trabajo/oferta-de-trabajo-de-profesional-en-marketing-en-bogota-dc-B89614199987459461373E686DCF3405","Profesional en Marketing","Importante compañía del sector de tecnología. Solicita para su equipo de trabajo Profesional en Marketing. Con mínimo 2 años de experiencia en cargos Engagement Marketing Strategist o similares.Responsabilidades- Apropiarse del ciclo de estrategias de marketing incluyendo visión, metas y tácticas decanal desde la planeación hasta la ejecución- Generar insights sobre los clientes y su relación con el producto- Aumentar el conocimiento de la marca entre los clientes al crear segmentos, diseñartácticas innovadoras y entender el ciclo punta a punta del cliente- Excelente comunicación escrita y verbal y habilidades de colaboración y presentación- Fuertes habilidades analíticas y cuantitativas, incluyendo la capacidad de usarinvestigación de cliente, data y métricas que soporten la intuición y eficiencia de losesfuerzos de marketingEl cargo: Este cargo es flexible a trabajo remoto y abierto a perfiles freelanceSalario: Aproximadamente $3´000.000 dependiendo las habilidades y conocimientos."
"https://www.computrabajo.com.co/ofertas-de-trabajo/oferta-de-trabajo-de-auxiliares-de-almacen-en-bogota-dc-38302142A67C5A5661373E686DCF3405","Auxiliares de almacén","Compañía de plásticos ubicada en Siberia, se encuentra en la búsqueda de Auxiliar de Almacén y bodega, Bachiller académico con mínimo 12 meses de experiencia en el cargo, para laborar de Lunes a Viernes 6:00 a 4:00 pm  o 12:00 pm a 10:00 pm y sábados de 7:00 a 12:00, Salario: MLMV+ prestaciones de ley,preferiblemente vivir en zonas cercanas a COTA, MOSQUERA, FUNZA, MADRID, FACA o con facilidad de transporte.y con curso de alturas vigente.Cargue y descargue de materialInventario  y organización de materialesRecepción, revisión y control de calidad de los materiales recibidosAlmacenaje de mercancia.SI CUMPLES CON EL PERFIL POR FAVOR APLICAR A LA OFERTA"
"https://www.computrabajo.com.co/ofertas-de-trabajo/oferta-de-trabajo-de-asesor-comercial-marketing-olfativo-norte-de-la-ciudad-en-bogota-dc-4694FF91A594D3D561373E686DCF3405","Asesor Comercial Marketing Olfativo - Norte de la ciudad","Importante empresa dedica al  venta e instalación  Marketing Olfativo, esta buscando para su equipo de trabajo asesores comerciales con experiencia de un año preferiblemente con experiencia en Marketing Olfativo para hacer parte de su equipo de trabajo la asignación salarial de $1,200.000 de salario básico + prestaciones laborales+ más el 6% de comisión por ventas."
"https://www.computrabajo.com.co/ofertas-de-trabajo/oferta-de-trabajo-de-analista-de-marketing-bilingue-en-ingles-en-medellin-50A9656FE0F2435A61373E686DCF3405","Analista de marketing - Bilingüe en Ingles","Somos una empresa de tecnología web, buscamos personas con experiencia en mercadeo digital o análisis de datos para unirse a nuestro equipo con sede en la ciudad de Medellín. El trabajo se enfoca en Análisis para canales de venta en Estados Unidos y la Unión Europea.El cargo consiste en analizar las posibilidades de mercadeo de nuestros productos en base a un estudio detallado de datos y estadísticas, usando herramientas tecnológicas.Requerimientos:- Inglés muy avanzado escrito y hablado.- Conocimiento avanzado de Excel y otras herramientas de calculo.- Formación en matemáticas, economía, administración ó ingeniería.- Disponibilidad inmediata"
