"URL","NOMBRE","DESCRIPCION"
"https://co.linkedin.com/jobs/view/quality-assurance-engineer-at-demand-frontier-1897332756?refId=e5d23c3e-3511-4ddc-8e66-b18a8756fde5&position=19&pageNum=0&trk=public_jobs_job-result-card_result-card_full-click","Quality Assurance Engineer","Quality Assurance EngineerDemand Frontier (DF TECH SAS) is looking for fulfill a need for a client in the US to build a team to operate in the Colombia time zone based out of Medellin. Our client is a global software and services provider for enterprise online events. Their cloud-based product portfolio includes virtual environments learning management and webinars. Designed for marketing sales recruitment training and HR communications they transform big ideas into real-world results. Lead by the most innovative and experienced leaders in online events the Client platform was built to be the most configurable secure and reliable product on the market. Their seasoned project managers who have experience working with companies across all industries provide hands-on support and strategic guidance. The Client has helped many leading brands increase the effectiveness of their online programs by driving revenue growth saving money and increased employee productivity. Our customers include Salesforce BlackRock GE CDC Ericsson CA Technologies and Intuit. The Quality Assurance Engineer will help our software development team in ensuring optimized QE processes are implemented and executed.  Essential Functions·       Prepares and Executes test cases for software products to meet defined testing service level agreements·       Evaluates test results against expected results and troubleshoots as needed·       Updates and maintains a regression test bed·       Designs develops and supports automated testing suites·       Automates all repetitive and repeatable testing activities·       Provides task status and defect reports to project team·       Aids the management of the agile Kanban board and owns and manages staging and production releases·       Troubleshoots and fixes production tickets that do not require any major development effort Education & Experience·       Bachelor’s degree preferably in a computer science-related field or equivalent relevant experience·       Five years of related experience which includes automated quality assurance and/or application development·       Experience with Agile and Agile-related software (i.e. Jira)·       Experience with programing and scripting language(s) such as Java Jscript SQL etc. ·       Experience testing across multiple platforms including desktop and mobile devices.·       Work closely with developers to provide feedback on PRs.·       Have working level understanding of basic AWS services.Knowledge Skills & Abilities·       Applied knowledge of functional and non-functional testing·       Applied knowledge of data transformation and data validation testing·       Applied knowledge of web services testing·       Basic understanding of Information Technology Infrastructure Library (ITIL) or International Organization for Standardization (ISO) and best practices preferred·       Strong attention to detail good organizational and multi-tasking skills·       Strong communication skillsMostrar másMostrar menos"
"https://co.linkedin.com/jobs/view/mid-level-rpa-developer-at-lean-tech-io-1959418201?refId=e5d23c3e-3511-4ddc-8e66-b18a8756fde5&position=20&pageNum=0&trk=public_jobs_job-result-card_result-card_full-click","Mid-level RPA Developer","ABOUT US We are a fast-growing startup in the city of Medellin with one of the most important networks of companies in the logistics industry among others. We have hundreds of opportunities for you to grow within TWO organizations Lean Tech and your assigned account. You will be working alongside a HUGE engineering team all over Colombia and in the US with the ability to travel once all of this is over!Job DescriptionRPA developers are responsible for the creation design development and implementation of RPA systems. They are required to investigate analyze and set up automated processes to maximize efficiency for a business model. This is done with the help of RPA technologies and tools. RPA developers should have a fundamental understanding of the problem they are trying to solve and must have great analytical and problem-solving skills.Duties and ResponsibilitiesWork in RPA project using RPA tooling.Will be a member of the core automation team The automation architect still has some experience in programming and solving a real-world problem.Possess full understanding of business rules and company goals regarding automation to be able to present tailored solutions to presented problems using automations tools. Skills Experience with RPA Software ( UIpath Automation Anywhere Blue Prism Power Automate ).Experience architecting and developing workflow-based solutions or functionality.Experience with web development technologies preferential.Willingness to learn and become an expert in RPA and other automation technologies.Must be able to multitask and willing to work on multiple projects at a given time.Development experience is a plus.Willingness to learn new technologies.Soft Skills Strong written and verbal communication skillsComfortable interacting with business stakeholders and external clientsAbility to work to deadlines and manage expectationsStrong analytical and problem-solving skillsAid in planning product development and timelinesProvide feedback to marketing or sales teamsExcellent understanding of the productExcellent understanding of the business problem the software is solvingExcellent understanding of the field the software's users are part of (medical HR etc.)Team PlayerUnderstanding of workflow-based logicStrong attention to detail and analytical skillsTalent to present technical detailsLeadership skillsShould be able to Prioritise and manage Multiple PortfoliosEnglish skills at a B1+ levelWe offer you:A signing bonus: A 1MM bonus for the first day you start with us.High salaries compared to the marketOwn the way you work: We offer REMOTE work or you can go to our amazing offices whenever you want.Prepaid Medical CareLean Points/BonusA continuous Learning cultureTo take part in meaningful projectsTo be able to work for hand in hand with the most successful companies in the US logistics and transportation industryOpportunities to growCustomized English lessonsAccess to online courses (Udemy - Platzi - Treehouse)Access to the mentorship Program (For all technologies)an excellent working environmentMany other benefits Come join us Let's grow together!Mostrar másMostrar menos"
"https://co.linkedin.com/jobs/view/trabaje-en-casa-llenando-encuestas-y-anuncios-publicitarios-villavicencio-at-marketing-digital-1958727352?refId=e5d23c3e-3511-4ddc-8e66-b18a8756fde5&position=21&pageNum=0&trk=public_jobs_job-result-card_result-card_full-click","Trabaje en Casa Llenando Encuestas y Anuncios publicitarios - VILLAVICENCIO","Importante Compañia Multinacional consultora de investigacion de mercados y de marketing y publicidad en medios digitales en el area de consumo masivo.Requiere de personas con o sin experiencia dinamicas y proactivas que deseen emprender desde casa generando muy buenos ingresos en horarios flexibles y automos realizando actividades comoLlenar y completar encuestas formularios y tareas en nuestras plataformas virtuales.Y Visualizando anuncios publicitarios.RequisitosTener celular o un computador con aseso a datos o internet.Ser persona mayor de 18 años de edad bien sean hombres o mujeres.REGISTRARTE PARA SER PARTE DE NUESTRO EQUIPO NO TIENE NINGUN COSTO!!Solo envianos un mensaje a correoempresarialsas (@) gmail. comCon la palabra me encuentro Interesado o interesada y Nosotros te enviaremos los link de enlace para que te registres en nuestras plataformas de encuestas virtuales y puedas comenzar a generar tus ingresos.NotaEn cada una de las plataformas de encuestas encontraras informacion detallada de cuanto generaras por cada encuesta tarea o formulario que llenes y el medio de pago.Mostrar másMostrar menos"
"https://co.linkedin.com/jobs/view/asesor-de-mercadeo-at-sandra-elizabeth-roa-linares-1958384459?refId=e5d23c3e-3511-4ddc-8e66-b18a8756fde5&position=22&pageNum=0&trk=public_jobs_job-result-card_result-card_full-click","Asesor de Mercadeo","DescripciónSolicitamos para empresa especializada en Ecoturismo un(a) Asesor de Mercadeo. Buscamos persona con perfil pro-activo con ganas de desarrollarse en el área realizando tareas generales vía remota con buena capacidad de comunicación que sepa trabajar en equipo todo el trabajo será desde la comodidad de su casa. Debe poseer teléfono inteligente y computadora con conexión a internet.Modalidad de contratación tipo freelance.Responsable en los procesos del área que incluyen entre otras: Hacer seguimiento a ofertas en curso. Generar nuevas oportunidades de negocio mantener actualizado la herramienta CRM Trello. Remitir publicidad a través de correos masivos de Marketing. Mantener actualizada publicidad la organización en Redes Sociales.RequisitosRequerimientos - Educación mínima: Terciaria - Años de experiencia: 1 - Conocimientos: Manejo de Redes Sociales CRM y Paquete Office - Disponibilidad de Viajar: No - Disponibilidad de cambio de residencia: NoMostrar másMostrar menos"
"https://co.linkedin.com/jobs/view/experienced-net-developer-at-sana-commerce-1884885035?refId=e5d23c3e-3511-4ddc-8e66-b18a8756fde5&position=23&pageNum=0&trk=public_jobs_job-result-card_result-card_full-click","Experienced .NET developer","Job DescriptionAs a software developer you work among the customization teams. Our customization teams are responsible for their projects from end-to-end by releasing their own code into production. You work closely together with colleagues and customers in the USA Netherlands Ukraine and Sri Lanka and learn in the process.Participate in requirements analysisDesign solutions according to the needs of the clients.Write codes with .Net programming languages and SQL developments.What’s in it for you?  Personal development. We believe that as our company grows our people should be able to grow with us. We value learning and development opportunities for all our employees. So from learning on the job to trainings and coaching it’s all there. Together with your manager you are in charge of your own personal growth. Onboarding and buddy program. It’s always quite new and exciting to start your next adventure. We value a strong onboarding. You will be joining our general onboarding will be introduced to a buddy and will get a role specific onboarding as well.  Entrepreneurial environment. We are a fast-growing international scale-up organization in software. We encourage initiatives and ideas from our people. We like to accomplish things together as a team.  Health and well-being. We believe that every employee should be at their best that’s why we want to offer you private healthcare and contribution to fitness subscription.Extra benefits: We offer flexible working hours Friday afternoon drinks Wednesday lunch and monthly Fun Fridays where we do paintball indoor rock climbing pub quiz karaoke and much more! QualificationsWhat you bring along:Understanding of the .NET Framework C# and OOP in general2+ years of experience with ASP.NET MVC3+ years of experience in back-end .NET / C# developmentSufficient knowledge of T-SQL MS Sql Server and at least one of ORM: NHibernate Entity FrameworkExperience with Javascript + Frameworks (JQuery React) HTML and CSSAbility to analyze business requirements and design technical solutions to match requirementsExperience with defining the system architecture of the project (the configuration of the server hosting  specifications etc.) project data (database scheme caching etc.) and software realization of the projectSpeaking and writing the English languageAbout usIt all started in 2007 with a pizza and a plan. One evening in Rotterdam the Netherlands five people came together over a pizza and set out to create a B2B e-commerce platform unlike any other. And Sana Commerce was born.Sana Commerce is an e-commerce platform designed to help distributors manufacturers and wholesalers succeed in an economy built on lasting customer relationships. How? By turning our customers’ SAP or Microsoft Dynamics ERP into the engine that powers their web store unlocking total customer convenience reliability without compromise and effortless scalability.Sana Commerce is currently powered by more than 400 employees. We all have our own expertise and specialties from sales and marketing to project management and more. But we’re all driven by the same goal: to make our customers’ e-commerce projects a success.Our core valuesSo what does being a part of the Sana team mean? Below is a list of our core values — the most important beliefs we look for in new colleagues and the foundation of our company culture. They guide us in our decision making and they define Sana’s personality as an organization.Entrepreneurial. Sana exists today because a few people had a great idea and brought that idea to life. Sana continues to grow and thrive because that same entrepreneurial spirit is still strong within the company.Result driven. We’re an ambitious group here at Sana there’s no denying that. We set tough targets and give our all to reach them. Of course we also know that being result-driven is about more than just KPIs. It’s about creating value tackling challenges head-on and supporting our colleagues in reaching their goals.Committed. No one said that getting 10000 active clients by 2030 was going to be easy! We’re in it for the long haul. Through good times and bad we stick together because we believe in our product our promise and our people.Team spirit. We love working together learning from each other and celebrating success. At Sana everyone is eager to help their colleagues and success is always a team effort.﻿Additional InformationPlease apply with your resume in english Mostrar másMostrar menos"
"https://co.linkedin.com/jobs/view/software-developer-php-senior-at-sproutloud-media-networks-1958726416?refId=e5d23c3e-3511-4ddc-8e66-b18a8756fde5&position=24&pageNum=0&trk=public_jobs_job-result-card_result-card_full-click","Software Developer (PHP) Senior","Company OverviewAt SproutLoud our people and culture are central to our success. You’ll find an environment that is 100% jerk free where people share the values of putting clients first being accountable caring about your team and the quality of your work inspiring others and growing in your level of expertise and professional development. Perhaps that's why for two years running (in both 2018 and 2019) we are ranked among the Top Work Places by the Sun Sentinel.SproutLoud is a Software plus Services platform that services the local marketing needs of large organizations. Called Through-Channel Marketing Automation (TCMA) we help our clients manage their brands and distribute their marketing resources locally - through sales channels franchisees chain-retail locations dealer networks value-added reseller (VAR) programs and field employees/offices - with a comprehensive distributed marketing solution. SproutLoud solutions manage brand compliance increase speed to market automate manual tasks and provide robust reporting and business intelligence.Identified by Forrester Research in 2018 as the Third Stage for sales and marketing leaders SproutLoud is on the forefront of the TCMA industry. We need a great team to help us execute - so come join us!Summary As a Sr. Software Developer you will be working with your agile team members to bring to fruition the SproutLoud’s development initiatives. The Sr. Software Developer will work with Product Owners and System Architects to help his/her team members to prioritize organize develop test and deploy enhancements or new features to SproutLoud’s applications and systems.  The Sr. Software developer needs to demonstrate a deep understanding of SproutLoud’s business processes and architecture in addition to advanced understanding enterprise web development and technologies using PHP programming language including object oriented concepts pertaining to PHP MVC web-services and persistence using RDBMS and NOSQL. The Sr. Software Developer must also have a very good understanding of front end technologies such as HTML5 CSS3 JavaScript XSS and Ajax.  The Sr. Software Developer is expected to train assist and provide feedback to Jr. team members as well as share his/her knowledge with other team members in other teams. A Sr. Software Developer is expected to keep up to date with industry standards and best practices and collaborate with the System Architect team to improve SproutLoud’s architecture tools and practices.  Challenges  Serve as a member of one of our development teams where you will be involved in the analysis design implementation and support for SproutLoud’s applications and systems  Design write and unit test complex pieces of code using object oriented programing concepts in PHP and JavaScript  Write SQL or PS/SQL procedures  Perform code reviews for other team members  Test and deploy new features or fixes to our Stage and Production environments  Work in an agile team environment  Work in a continuous integration environment  Work closely with Product Owner to drive new feature creation software testing and quality assurance  Interact with stakeholders and management to make key decisions with regards to the application functionality  Train coach and advise other team members about development best practices  Show a keen eye for detail and ability to adhere to deadlines within a fast paced environment  Make key decisions and judgments on your own Qualifications And Skills5+ years commercial experience with OO PHP 5+3+ years experience with an MVC framework 2+ years experience with CSS HTML JavaScript and jQuery  Working knowledge of Design Patterns  Working knowledge of UML  Working knowledge of SQL  Experience with Git  Experience with Unix/Linux environments  Good oral and written communication skills Not Required But Would Be a Plus Experience integrating with web-services  Experience with Ajax  Experience with PostgreSQL  Experience with Agile Development  Experience Unit Testing Benefits And PerksAt SproutLoud we continue to cultivate an environment that aspires to be one of the best places to work - period. SproutLoud pays the full cost of some benefit programs with our team members. Benefits include health-care coverage (Poliza de Seguro Sura) transportation/parking benefit maternity and paternity benefits professional development generous paid time off (PTO) policy employee and client referral programs and wellness initiatives. We also have fun along the way - a partially paid gym membership community involvement events creative recognition programs breakfast Fridays BBQ/picnic summers annual kick off events monthly happy hours/team building activities casual dress code etc. And because we believe in keeping the innovative spirit alive over the long haul we provide a paid four-week sabbatical leave after every sixth year of service for team members to recharge renew and reboot.Having a career at SproutLoud means you are on a team that helps each other win. You will be in an environment that is 100% jerk-free and share values with others who are accountable care inspire elevate and grow. Come grow with SproutLoud!Mostrar másMostrar menos"
"https://co.linkedin.com/jobs/view/senior-nodejs-developer-at-lean-tech-io-1929330706?refId=e5d23c3e-3511-4ddc-8e66-b18a8756fde5&position=25&pageNum=0&trk=public_jobs_job-result-card_result-card_full-click","Senior NodeJS Developer","ABOUT USWe are a fast-growing startup in the city of Medellin with one of the most important networks of companies in the logistics industry among others. We have hundreds of opportunities for you to grow within TWO organizations Lean Tech and your assigned account. You will be working alongside a HUGE engineering team all over Colombia and in the US with the ability to travel once all of this is over!Job DescriptionA back-end web developer is responsible for server-side web application logic and integration of the work front-end developers do. Back-end developers are usually writing the web services and APIs used by front-end developers and mobile application developers.Providing general design guidance and putting work into the foundation and early stages of a product's development acting as a bridge or connector between your development team and the other business-oriented departments in your organization.ResponsibilitiesIntegration of user-facing elements developed by front-end developers with server-side logicBuilding reusable code and libraries for future useOptimization of the application for maximum speed and scalabilityImplementation of security and data protectionDesign and implementation of data storage solutions Technical Requirements  4+ years of experience as a Back-end developer4+ years of experience with programming languages like javascript and ecosystems like Node.jsBA degree in Computer Science or similar relevant fieldUser authentication and authorization between multiple systems servers and environmentsIntegration of multiple data sources and databases into one systemSetup and administration of backupsOutputting data in different formatsUnderstanding differences between multiple delivery platforms such as mobile vs desktop and optimizing output to match the specific platformCreating database schemas that represent and support business processesImplementing automated testing platforms and unit testsProficient knowledge of a back-end programming language Proficient understanding of code versioning tools such as GitUnderstanding of “session management” in a distributed server environmentGood knowledge in Node.js model-view-controllers (MVC) frameworks like Express (most important) and othersProficiency in RESTful APIs and API communicationsAsynchronous Programming and its workaroundsError-handling skillsSoft SkillsAid in planning product development and timelinesProvide feedback to marketing or sales teamsExcellent communication skillsExcellent understanding of the productExcellent understanding of the business problem the software is solvingExcellent understanding of the field the software's users are part of (medical HR etc.)Team PlayerUnderstanding of other disciplines like management product development marketing etc.We offer you:A signing bonus: A 1MM bonus for the first day you start with us.High salaries compared to the marketOwn the way you work: We offer REMOTE work or you can go to our amazing offices whenever you want.Prepaid Medical CareLean Points/BonusA continuous Learning cultureTo take part in meaningful projectsTo be able to work for hand in hand with the most successful companies in the US logistics and transportation industryOpportunities to growCustomized English lessonsAccess to online courses (Udemy - Platzi - Treehouse)Access to the mentorship Program (For all technologies)an excellent working environmentMany other benefits Come join us! Let's grow together. Mostrar másMostrar menos"
"https://co.linkedin.com/jobs/view/trabaje-en-casa-llenando-encuestas-y-anuncios-publicitarios-santa-marta-at-marketing-digital-1958725564?refId=47775738-1997-4c57-999b-105b5ad17b9d&position=1&pageNum=1&trk=public_jobs_job-result-card_result-card_full-click","Trabaje en Casa Llenando Encuestas y Anuncios publicitarios - SANTA MARTA","Importante Compañia Multinacional consultora de investigacion de mercados y de marketing y publicidad en medios digitales en el area de consumo masivo.Requiere de personas con o sin experiencia dinamicas y proactivas que deseen emprender desde casa generando muy buenos ingresos en horarios flexibles y automos realizando actividades comoLlenar y completar encuestas formularios y tareas en nuestras plataformas virtuales.Y Visualizando anuncios publicitarios.RequisitosTener celular o un computador con aseso a datos o internet.Ser persona mayor de 18 años de edad bien sean hombres o mujeres.REGISTRARTE PARA SER PARTE DE NUESTRO EQUIPO NO TIENE NINGUN COSTO!!Solo envianos un mensaje a correoempresarialsas (@) gmail. comCon la palabra me encuentro Interesado o interesada y Nosotros te enviaremos los link de enlace para que te registres en nuestras plataformas de encuestas virtuales y puedas comenzar a generar tus ingresos.NotaEn cada una de las plataformas de encuestas encontraras informacion detallada de cuanto generaras por cada encuesta tarea o formulario que llenes y el medio de pago.Mostrar másMostrar menos"
