"URL","NOMBRE","DESCRIPCION"
"https://www.computrabajo.com.co/ofertas-de-trabajo/oferta-de-trabajo-de-ejecutivo-de-ventas-trade-marketing-en-medellin-E786E41F64A6931A61373E686DCF3405","Ejecutivo de ventas Trade Marketing","Importante multinacional de bebidas gaseosas, requiere para su equipo de trabajo técnico en áreas comerciales  o administrativas con 3 años de experiencia en trade marketing de productos de consumo masivo que cuente con vehículo o moto HORARIO: Lunes a sábados disponibilidad de viajar salario $1.100.000+ Prestaciones de ley + comisiones + Beneficios de compañía + Auxilio de Rodamiento"
"https://www.computrabajo.com.co/ofertas-de-trabajo/oferta-de-trabajo-de-ejecutivo-de-ventas-trade-marketing-viajero-en-girardot-B5B06A51447BAFE161373E686DCF3405","Ejecutivo de ventas Trade Marketing - Viajero","Importante multinacional de bebidas gaseosas, requiere para su equipo de trabajo técnico en áreas comerciales  o administrativas con 3 años de experiencia en trade marketing de productos de consumo masivo que cuente con vehículo o moto HORARIO: Lunes a sábados disponibilidad de viajar salario $1.100.000+ Prestaciones de ley + comisiones + Beneficios de compañía + Auxilio de Rodamiento"
"https://www.computrabajo.com.co/ofertas-de-trabajo/oferta-de-trabajo-de-coordinador-trade-marketing-consumo-masivo-en-bogota-dc-04CAC52A699448DE61373E686DCF3405","Coordinador Trade Marketing - Consumo Masivo","Importante empresa de Consumo Masivo requiere para su equipo de trabajo Profesionales en publicidad y mercadeo, administrativas o afines, con experiencia mínima de 1 año en planeación, desarrollo y ejecución de estrategias globales, soporte a ejecutivos de las regionales, visual merchandising, seguimiento a los  KPI’s y elaboración de informes de Mystery Shopper, entre otros. Nivel de inglés avanzado.  Salario: 3.000.000 + prestaciones de ley. Horario: lunes a viernes: 9:00 a.m. – 6:00 p.m."
"https://www.computrabajo.com.co/ofertas-de-trabajo/oferta-de-trabajo-de-analista-marketing-digital-experiencia-analisis-metrica-mercado-y-competencia-en-medellin-4E4B2754470D51AE61373E686DCF3405","Analista Marketing digital - Experiencia análisis métrica mercado y competencia","Se requiere profesional analista Marketing digital: profesional en áreas afines a mercadeo con experiencia de más de 3 años realizando análisis de métricas, de mercado y competencia, branding y análisis de  landing pages,  SEM Y SEO, Seguimiento a LEADS, Manejo de Google Adwords, Google Analytics, Google Search Console, Google Trends, Manejo de Wordpress, conocimiento de Pautas en social Media."
"https://www.computrabajo.com.co/ofertas-de-trabajo/oferta-de-trabajo-de-content-manager-copyright-con-12-meses-de-experiencia-en-campanas-marketing-digital-en-medellin-B54EE087BBE2C46361373E686DCF3405","Content Manager (copyright) con 12 meses de experiencia en campañas marketing digital","Importante Clínica Odontológica requiere COMMUNITY MANAGER con mínimo un año de experiencia con conocimiento en estructura de campañas, marketing digital, conocimiento en diseño gráfico, diseño y elaboración de páginas web, elaboración de piezas publicitarias.Con experiencia de 12 meses en campañas de marketing y redes sociales digitalesFunciones: -Diseñar la estrategia y optimizar la pauta digital en Facebook, Instagram y Google -Generar y proponer estrategias para potenciar la clínica IMPORTANTE: ser un comunicador magnético, Revolucionario, Innovador, Propositivo, Proactivo, estratega y organizado Nivel Académico:  Tecnólogo Contrato: termino fijo renovable Salario: $ 1.600.000 Horario: lunes a viernes de 8:00 am a 6:00 pm y sábados de 8:00 am a 1:00 Lugar de puesto de trabajo: Medellín"
"https://www.computrabajo.com.co/ofertas-de-trabajo/oferta-de-trabajo-de-analista-de-presupuestos-bilingue-trade-marketing-en-bogota-dc-36F2FDE1D3FF008161373E686DCF3405","Analista de presupuestos bilingüe - trade marketing","Reconocida compañía esta en busca de analista de presupuestos para el apoyo en ejecución, presentación, planeación  del presupuesto de 3 países  Colombia Perú y Chile debe tener conocimiento en kpis, budget, reportes, ordenes de compra, costos, facturación, entre otros, Debes ser bilingüe y tener manejo de excel avanzado puedes estar en últimos semestres de carreras administrativas o financierasDebe conocer del área de trade marketing o salesSalario $2.500.000+ prestaciones de ley oportunidades de crecimiento"
"https://www.computrabajo.com.co/ofertas-de-trabajo/oferta-de-trabajo-de-asistente-de-marketing-en-bucaramanga-167C965B32A513E461373E686DCF3405","Asistente de Marketing","Empresa de alimentos de consumo masivo requiere para su equipo de trabajo Tecnólogo o profesional en mercadeo o afines con experiencia en marketing digital, manejo de redes sociales, paginas web, estrategias de mercadeo, publicidad y ventas.Horario: Lunes a Sábado Interesados aplicar adjuntando hoja de vida en word o pdf"
"https://www.computrabajo.com.co/ofertas-de-trabajo/oferta-de-trabajo-de-marketing-de-autorizacion-de-management-en-cali-B6D3938DCB85E40861373E686DCF3405","marketing de autorización de management","Estamos en la búsqueda de una persona que 1) Le guste y apasione el diseño de estrategias para aumento de ventas de los clientes a través de la automatización del marketing digital2) Facilidad para crear y redactar guiones de ventas de ricos utilizando el neuro marketing y 3) Manejo del CRM para crear base de datos en donde pueda realizar procesos de ventas acompañando del WhatsApp Business * Ventas y conocimiento avanzado en procesos de atracción de clientes, conocimiento en marketing y programas Empresas donde el candidato tenga experiencia : Agencias de Publicidad Competencias y habilidades requeridas : - agilidad,-buena expresión corporal, - presentación personal,- empatía y confianza ,- proactividad, - autonomía, -redacción,- paciencia e insistencia"
"https://www.computrabajo.com.co/ofertas-de-trabajo/oferta-de-trabajo-de-analista-de-marketing-digital-en-medellin-en-medellin-56C109FD4A16998361373E686DCF3405","Analista de Marketing Digital - En Medellín","Requisitos Mínimos:•	Nivel de Estudio: tecnólogo o profesional en Mercadeo, Marketing digital o carreras afines.•	Manejo de Google Analytics y Google Adwords•       Administración y optimización de SEO, planeación de estrategias SEM.•	Manejo de Redes sociales•	Buena presentación personal•	Radicado en MedellínActividades a Desarrollar:•	Definición, implementación y seguimiento de estrategias SEO y SEM•	Elaboración de informes mensuales (Pautas digitales y KPI´s)•	Monitoreo y seguimiento de campañas•	Seguimiento y mejora del SEO.•	Planteamiento y ejecución de campañas de SEM.•	Gestión de presupuestos.•	Crear, definir e implementar el Plan de Marketing para el canal online.•	Medir y analizar la rentabilidad de las acciones de Marketing realizadas.•	Experiencia en mejora y posicionamiento marca, sitio web."
"https://www.computrabajo.com.co/ofertas-de-trabajo/oferta-de-trabajo-de-aprendiz-diseno-grafico-en-medellin-20036BD5C16F5C6261373E686DCF3405","Aprendiz diseño Gráfico","Marketing requiere Aprendiz de diseño gráfico, que requiera realizar su etapa productiva.EDUCACIÓN REQUERIDA: •	Estudiante de Diseño GraficoCONOCIMIENTOS ESPECÍFICOS: •	Programas de diseño: suite de Adobe (Illustrator, Photoshop, InDesign). •	Herramientas ofimáticas•	Manejo general de herramientas  de Mac- preferiblemente, pero se puede aprender.MISIÓN DEL CARGO:•	Apoyar la materialización de los objetivos del  proceso de post producción generando un buen modelado de las prendas en las fotografías, garantizando que el color sea fiel a la muestra original, manejando la buena imagen del catálogo, con un nivel de respuesta de acuerdo al cronograma y cero errores.FUNCIONES ESPECÍFICAS:•	Retocar y garantizar el modelado de las prendas en las fotografías de acuerdo a la línea que le corresponde.•	Entonar prendas o productos.•	Realizar cambios solicitados en cualquier momento de la campaña.•	Entregar los archivos a los proveedores en el tiempo establecido.•	Demás actividades asignadas por el jefe inmediato.salario 75% de la cuota de apoyo estipulada por la ley de acuerdo a contrato Sena, servicio de restaurante, libreta de beneficios, horario flexible"
"https://www.computrabajo.com.co/ofertas-de-trabajo/oferta-de-trabajo-de-analista-marketing-digital-en-bogota-dc-9F998CAB131948DB61373E686DCF3405","Analista Marketing Digital","Laboratorio farmacéutico especializado en productos FITOTERAPEUTICOS requiere para su equipo de trabajo ANALISTA MARKETING DIGITAL con experiencia. Funciones: ser estratega, creativo, generar comunicación digital con los clientes, creación y gestión de contenido, conocimientos y experiencias en redes E-Commerce, crear estrategias de marketing, conocimiento en pauta digital, manejo de redes sociales.- Excelente Actitud y presentación personal.Ofrecemos buen ambiente de trabajo, capacitación, desarrollo y crecimiento profesional.Se garantiza contrato con todas las prestaciones de ley, estabilidad laboral, crecimiento y proyección.Horario: miércoles a domingos 9:00 am – 6:00 pmSalario: $1.500.000"
"https://www.computrabajo.com.co/ofertas-de-trabajo/oferta-de-trabajo-de-digital-marketing-assistant-advanced-english-en-bogota-dc-589DE3B62106B57361373E686DCF3405","Digital Marketing Assistant - advanced english","LEER CONDICIONES ANTES DE APLICARCompañía de Real Estate con sede en Miami. Requiere Asistente de Marketing Digital con nivel de ingles avanzado, estudiante de últimos semestres o profesional en mercado, publicidad o carreras afines, con un mínimo de experiencia laboral de 2 años en el cargo. Debe residir en BOGOTÁDebe tener conocimientos avanzado en:1. Creación de Campañas de Google Adwords.2. Optimización y seguimiento de Campañas.3. Manejo de google analitycs.4. Creación de contenido para Facebook e Instagram.5. Conocimiento básico de algún programa de edición de imágenes.Resumen de las condiciones salariales:Horario: Lunes a Viernes 9:00am a 6:00pm (Hora Miami, USA)Modalidad de trabajo: Home officeModalidad de contrato: Contrato directo compañía de Estados Unidos - Prestación de Servicios (No cubre prestaciones sociales)Salario: $2.500.000 + 250.000 (Bonificación mensual) SIN RETEFUENTE – PAGO NETO"
"https://www.computrabajo.com.co/ofertas-de-trabajo/oferta-de-trabajo-de-merca-impulsadora-postulate-en-bucaramanga-25C5D6B7DC88B3E761373E686DCF3405","Merca Impulsadora - Postulate!!!","Importante empresa de consumo masivo requiere para su equipo de trabajo Bachiller,técnica o tecnologa  con experiencia de 1 año realizando labores de mercadeo e impulso tanto en grandes superficies como tiendas de barrios y plazas mayoristas; debe contar con excelente presentación personal, con actitud positiva,empoderada, propositiva, que tenga aptitud; dentro de sus funciones esta: Realizar mercadeo e impulso en los puntos asignados,acompañamiento a las distintas fuerzas de ventas, rotación de producto, seguimiento de inventarios entre otros.Horario: 8 horas variables dependiendo el almacén que le sea asignado.( debe contar con disponibilidad de tiempo)"
"https://www.computrabajo.com.co/ofertas-de-trabajo/oferta-de-trabajo-de-lider-marketing-home-office-tunja-en-tunja-D81B9E5A3756748861373E686DCF3405","Lider Marketing - Home Office  Tunja","Multinacional con operaciones en 9 países de América latina y 15 ciudades principales de Colombia con 15 años de experiencia, requiere para su equipo de trabajo (Marketing y gestión comercial) profesionales que quiera trabajar de forma inmediata HOME OFFICE.REQUISITOS:1. Excelente equipo de cómputo.2. Internet potente.3. Plan de datos y llamadas ilimitadas4. Excelente expresión verbal.5. Presentación personal impecable 6. Determinado a ser medido por resultados y metas alcanzadas. BENEFICIOS: 1. Vinculación inicial por prestación de servicios, posibilidad de contrato a término indefinido, plan de carrera y ascensos con vinculación laboral definitiva. 2. Honorarios bonos+ incentivos generando unos ingresos promedio de 2.000.000 mensuales en estado de aislamiento. 3. Entrenamiento constante y permanente, en el cargo que le darán el conocimiento suficiente para desempeñar el cargo. Si desea vincularse temporalmente o de forma definitiva, tenemos abiertas las dos opciones. Estará trabajando en el sector educativo con mayor proyección y con los mejores pronósticos de crecimiento a corto plazo."
"https://www.computrabajo.com.co/ofertas-de-trabajo/oferta-de-trabajo-de-ejecutivoa-departamento-de-marketing-en-villavicencio-75AD913A6112489061373E686DCF3405","ejecutivo/a - Departamento de Marketing","AVISO HOME OFFICE MARKETINGMultinacional con operaciones en 9 países de América latina y 15 ciudades principales de Colombia con 15 años de experiencia, requiere para su equipo de trabajo (Marketing y gestión comercial) profesionales que quiera trabajar de forma inmediata HOME OFFICE.REQUISITOS:1. Excelente equipo de cómputo.2. Internet potente.3. Plan de datos y llamadas ilimitadas4. Excelente expresión verbal.5. Presentación personal impecable 6. Determinado a ser medido por resultados y metas alcanzadas. BENEFICIOS: 1. Vinculación inicial por prestación de servicios, posibilidad de contrato a término indefinido, plan de carrera y ascensos con vinculación laboral definitiva. 2. Honorarios bonos+ incentivos generando unos ingresos promedio de 2.000.000 mensuales en estado de aislamiento. 3. Entrenamiento constante y permanente, en el cargo que le darán el conocimiento suficiente para desempeñar el cargo. Si desea vincularse temporalmente o de forma definitiva, tenemos abiertas las dos opciones. Estará trabajando en el sector educativo con mayor proyección y con los mejores pronósticos de crecimiento a corto plazo."
"https://www.computrabajo.com.co/ofertas-de-trabajo/oferta-de-trabajo-de-asesor-comercial-marketing-digital-en-bogota-dc-4993788A5BD0361E61373E686DCF3405","Asesor Comercial - Marketing digital","Es tu oportunidad!Haz parte de la empresa líder en Marketing Digital en Colombia!Debes contar con excelentes habilidades comercialesOrientación a resultadosExcelente fluidez verbalExcelente presentación personalMínimo 1 año de experiencia certificable en ventas de productos tangibles e intangibles.Te ofrecemos la posibilidad de crecer en un excelente equipo de trabajoSalario Básico de $1.100.000 + prestaciones de ley + variable por gestión realizada y beneficios de la Compañía."
"https://www.computrabajo.com.co/ofertas-de-trabajo/oferta-de-trabajo-de-director-marketing-bilingue-en-bogota-dc-EA4628B16FABD60161373E686DCF3405","Director marketing - Bilingue","Importante empresa del sector industrial esta en búsqueda de Magister o especialista en Marketing, Informática, Cadena de suministro y/o campos relacionados con los negocios. Profesional en Marketing o Publicidad, estudios de pregrado relacionados con estrategias de mercadeo, con 5 años de experiencia en cargos relacionados.CONOCIMIENTOS ESPECÍFICOS: haber liderado proyectos de automatización de procesos de una compañía y 2. No han tenido a su cargo personal de Desarrolladores Web o terceros que manejen el tema de desarrollo web o automatización.  Conocimiento completo de principios de marketing (marca, gestión de productos y servicios).-       Conocimiento completo de principios de marketing (marca, gestión de productos y servicios).-       Estrategias de marketing digital -       Estrategias de marketing off line-       Estrategias de mercadeo enfocadas al modelo de negocio B2B -       Cursos de liderazgo o gerencia de equipos multifuncionales-       Google Analytics, Google Adwords.-       Conocimientos de content design, Ads, look &amp; feels Design, Dirección de arte, Diseño UX UI y producción audiovisual.-       Conocimiento en tecnologías y desarrollo. Front y Backend-       Ingles Avanzado-       Excel intermedio- avanzado-       Habilidades de comunicación y sinterización, escritas y verbales-       Cadena de suministro cloud/ high tech.-       Comprensión profunda de la dinámica cambiante del mercado.-       Conocimiento y Experiencias certificables en plataformas de Zoho y SAP. Salario$4.000.000 + prestaciones de ley"
"https://www.computrabajo.com.co/ofertas-de-trabajo/oferta-de-trabajo-de-coordinador-marketing-en-bucaramanga-27A8A494E2E9BE7161373E686DCF3405","Coordinador marketing","Importante empresa importadora, requiere coordinador de marketing, debe tener titulo profesional en areas a fines, experiencia minima de 3 años en el  departamento de marketing y conocimiento comprobable en procesos digitales."
"https://www.computrabajo.com.co/ofertas-de-trabajo/oferta-de-trabajo-de-coordinador-comercial-en-empresas-de-servicios-de-aseo-o-funerarias-tec-o-tecnologo-en-ventas-mercadeo-marketing-en-bogota-dc-56061CF24CA66F7361373E686DCF3405","Coordinador comercial en empresas de servicios de aseo o funerarias - tec o tecnologo en ventas  mercadeo  marketing","Importante empresa reconocida requiere con urgencia para su equipo de trabajo mujeres u hombres técnicos o tecnologos en ventas, mercadeo marketing  asesoramiento comercial, con experiencia de 2 años de experiencia  manejando  prestadoras  de servicio, preferiblemente  en el sector  de servicio generales,salario : 1.500.000 + prestaciones de ley + aux transporte •	Asegurado de ventas por 3 meses de 300.000 de ahi en Adelante gana por comisiónhorario : lunes a sabadoSi te encuetras interesada (o) postular hoja de vida"
"https://www.computrabajo.com.co/ofertas-de-trabajo/oferta-de-trabajo-de-bi-analyst-en-bogota-dc-D04C56F46B03969761373E686DCF3405","BI Analyst","Se requiere profesional de economía, Ingeniería Industrial, Mercadeo y publicidad, Ingeniería de Sistemas, Administración de Empresas, Negocios Internacionales. Experiencia mínimo de dos años en:-Análisis comercial,-Inteligencia comercial o inteligencia de negocios,-Análisis Trade Marketing,-Ejecución de el SI2 bajos los pilares DataCollection, DataValidation, DataAnalytics con enfoque en Trade Marketing.-Dominio de Google DataStudio, Power BI.-Dominio de manejadores de datos SQL, MySql, Power Query, Power PivotRequisitos:-Indispensable nivel avanzado de Excel.-Conocimiento de alguna herramienta de BI.Competencias;-Empatía-Comunicación constante con el cliente para entender y dar requerimientos"
"https://www.computrabajo.com.co/ofertas-de-trabajo/oferta-de-trabajo-de-asesor-comercial-freelance-venta-de-eventos-btl-atl-y-otros-en-bogota-dc-3042D9FCE81443BB61373E686DCF3405","Asesor Comercial Freelance - Venta de eventos Btl Atl y Otros","Importante Multinacional  se encuentra en la búsqueda de Asesores Comerciales Freelance, que cuente con un portafolio propio de clientes a los cuales haya ofrecido y vendido actividades de BTL, ATL Y OTROS, deberá desarrollar labores como: Consecución de nuevos clientes,elaboración de presupuestos de actividades detallando los costos y garantizando la rentabilidad de las mismas,recepción del Brief y recopilación de la información necesaria para iniciar el proceso creativo,planificación de los tiempos de producción garantizando la adecuada ejecución de las actividades,seguimiento  a la facturación y el pago de las mismas de los clientes a su cargo entre otras funciones. Debe contar con portafolio propio de clientes."
"https://www.computrabajo.com.co/ofertas-de-trabajo/oferta-de-trabajo-de-marketing-digital--hotel-revenue-manager-en-bogota-dc-C96C67EE1C18198561373E686DCF3405","Marketing Digital  - Hotel Revenue Manager","Estamos en la búsqueda de persona con experiencia en el manejo de ofertas y paridad de precios en OTA´s, administración del channel manager y gestión del mercadeo digital para la oferta comercial en linea del hotel.La persona interesada debe tener experiencia comprobada con las extranet de las plataformas mas utilizadas en Colombia, con channel managers, y con algun paquete PMS.Remuneración: Entre 1,600,000 a 2,000,0000 mensual."
"https://www.computrabajo.com.co/ofertas-de-trabajo/oferta-de-trabajo-de-asistente-de-marketing-digital-y-ventas-en-bogota-dc-F281A90BC7BF4F5861373E686DCF3405","Asistente de marketing  digital y ventas","Importante empresa requiere para su  equipo de trabajo ASISTENTE DE MARKETING DIGITAL Y VENTAS , con experiencia en marketing digital, posicionamiento SEO orgánico y por google adwords, manejo de redes sociales. Debe tener al menos 1 año de experiencia con resultados que puedan ser validados.FUNCIONES• Hacer fichas técnicas y promocionales para enviar por correo electrónico. Manejo deredes sociales.• Coordinar y participar activamente en la comunicación con los clientes (envío deInformación técnica, comercial, entre otras)• Apoyo en la elaboración de presentaciones comerciales• Trabajo con bases de datos, actualizar bases de datos. Llamar a los clientes paraOfrecer los productos de la compañía. Venta telefónica• Tener todo el material publicitario, catálogos, material P.O.P y fichas técnicas y lodemás requerido en carpetas debidamente ordenadas de acuerdo con el catálogo de productos por segmento definido en la compañía. Salario 1.000.000"
"https://www.computrabajo.com.co/ofertas-de-trabajo/oferta-de-trabajo-de-lider-de-imagen-y-marketing-digital-disenadora-grafico-en-medellin-F8F075B5862D6AA661373E686DCF3405","Líder de Imagen y Marketing Digital - Diseñador(a) Gráfico","En OilRed nos apasiona lo que hacemos, somos personas integras, proactivas, positivas, innovadoras, un súper equipo que ha aprendido que juntos logramos todo lo que nos proponemos.¿Quieres ser un Talento OilRed? ¿Te apasiona el diseño y el marketing digital?  Buscamos para nuestro equipo de trabajo Líder de Imagen y Marketing DigitalRequisitos: Profesional en diseño,  con conocimientos en : Administración de sitio web, e-commerce Gestión de redes sociales (programación,pauta, indicadores y estrategia)Programas de diseño (ai, photoshop)Edición de vídeosOferta laboralModalidad TeletrabajoSalario a ConvenirContrato a termino indefinido todas las prestaciones de ley.Horario: Lunes a viernes de 7:00am a 5:00pm Sabados de 8:00am a 12:00pm"
"https://www.computrabajo.com.co/ofertas-de-trabajo/oferta-de-trabajo-de-digital-marketing-e-commerce-en-bogota-dc-659BF0DFCC05669261373E686DCF3405","Digital Marketing e commerce","Misión: Administrar el contenido back end de la compañía desde la plataforma Vtex, asegurando el mantenimiento, implementación y desarrollo de las diferentes funcionalidades de la plataforma.Importante manejo alto de excel.Manejo de bases de datos.Resposabilidades: Monitorear, configurar y controlar los diferentes módulos (pedidos, precios, promociones, master data, entre otros) de la plataforma Vtex.Implementar campañas SEO, SEM, RRSS en Google, FB, IG, y demás redes de negocios.Analizar las diferentes propuestas o requerimientos de la coordinación de mercadeo y e-Commerce y las áreas comerciales, asegurando la implementación y optimización de la propuesta en la plataforma.Asistir en el proceso de desarrollo de las integraciones con el área de Tics.Apoyo en redes sociales y contenido para las mismas."
"https://www.computrabajo.com.co/ofertas-de-trabajo/oferta-de-trabajo-de-coordinador-de-marketing-digital-bogota-en-bogota-dc-224FA31C3E8A6AD861373E686DCF3405","Coordinador de Marketing Digital - Bogota","Importante empresa del sector construcción requiere: Coordinador de Marketing Digital, profesional en áreas a fines, con conocimientos y habilidades en Planeación estratégica y experiencia mínima de 3 años en Marketing Digital, responsable del diseño y ejecución de las diferentes estrategias digitales, amplio conocimiento en redes sociales, manejo y optimización de CRM, conocimiento de nuevos desarrollos de los diferentes canales digitales, inbound marketing, email makerting, manejo de Agencia digital, optimización y posicionamiento SEO y SEM, análisis y manejo de estadísticas de Google analitics,   comunicaciones y manejo de parrillas de publicaciones para las Marcas y sus análisis métricas, Orientación a la consecución de metas, seguimiento a medios de comunicación institucional, manejo de presupuestos, manejo de comunicaciones internas ."
"https://www.computrabajo.com.co/ofertas-de-trabajo/oferta-de-trabajo-de-profesional-en-marketing-digital-especialista-en-seo-sem-en-medellin-6A6D31B750F0685E61373E686DCF3405","Profesional en Marketing Digital - Especialista en SEO – SEM","Requerimos un hombre o una mujer extremadamente creativ@ con conocimientos y experiencia demostrable en:SEO- SEO, Avanzado.- Estudio de competencia- Búsqueda de palabras claves- Optimización On pageSEM-  SEM publicidad de pago por clic – Certificado por Google Adwords, Avanzado.- Experiencia en creación de campañas y manipulación de presupuestos- Creación de anuncios- A/B testing- Campañas pagas en Facebook e instagram- Administración de Instagram y linkedin- Analitycs – Analítica web, sistemas de estadística- Wordpress- Experiencia en relacionarse con clientes.Es indispensable contar con mas de 2 años de experiencia.Salario a convenir con base a la formación académica y experiencia entre $1.800.000 y $2.500.000"
